candidate_id,raw_id,raw_published_at,published_at,published_at_utc,published_at_china,raw_source_published_at,source_published_at_utc,source_published_at_china,source_timezone,source_timezone_assumption,source_lag_minutes,backtest_time,backtest_time_utc,backtest_time_china,backtest_time_basis,time_timezone_assumption,time_parse_status,time_parse_flags,title,content,source,url,candidate_asset_symbol,candidate_binance_spot_symbol,candidate_binance_futures_symbol,candidate_event_type,candidate_direction_hint,candidate_importance,event_scope,asset_confidence,time_confidence,needs_review,review_decision,review_notes,quality_flags,auto_quality_score,suggested_reason,suggested_review_decision,review_priority,parsed_backtest_time_utc,event_age_hours,horizon_status,is_mature_72h,historical_replay_mode
cand_00388,news:1023:ef688f76e73df0b7,2026-05-18T18:13:48Z,2026-05-19 02:13:48 UTC+8,2026-05-18T18:13:48Z,2026-05-19 02:13:48 UTC+8,,,,UTC,source_rule:news:cryptonews,,2026-05-19 02:13:48 UTC+8,2026-05-18T18:13:48Z,2026-05-19 02:13:48 UTC+8,published_at,Asia/Shanghai_for_naive_time,ok,,"Leading AI day trading bots in 2026: Why most fail, and what actually works","Disclosure: This article does not represent investment advice. The content and materials featured on this page are for educational purposes only.

AI crypto trading bots surge in demand as traders struggle with volatility and unreliable automation tools.

The global AI trading platform market surpassed $11 billion in 2024 and is on track toward $33 billion by 2030. Demand is surging — and so is disappointment.

Thousands of traders in 2026 are searching for a Claude AI trading bot , a quick ChatGPT-powered script, or a generic AI day trading bot they can deploy overnight. Most fail to profit. Many lose money. The reasons are consistent: untested strategies, zero built-in risk controls, and no live market optimization.

In 2026, crypto markets move faster than ever. Bitcoin volatility remains elevated, memecoin rotations happen within hours, and macro events shift liquidity across the entire digital asset market in minutes. Reacting manually — or relying on an improvised LLM-based script — is no longer viable.

This guide ranks the best platforms for automated AI crypto day trading , with an honest look at what separates winners from the rest.

Best for: Beginners, passive investors, and anyone who wants a no-code AI crypto trading bot with real risk management

SaintQuant is the clearest answer for traders who want automated AI day trading without technical setup or coding knowledge. While other platforms require strategy configuration, API wiring, and ongoing maintenance, SaintQuant provides pre-optimized quantitative strategies that are live and running from day one.

What makes SaintQuant stand out in 2026:

Best for: Anyone searching for a reliable no-code AI crypto trading platform that handles execution, risk, and strategy automatically.

Limitation: Crypto-only (not stocks or forex); pre-built strategies are not manually customizable.

Verdict: SaintQuant is the most complete answer to what most traders actually want from an AI day trading bot in 2026 — hands-free execution with real risk controls, zero setup, and a risk-free way to start.

Best for: Active traders who want multi-exchange control and custom strategy workflows

3Commas remains one of the most recognized names in crypto automation in 2026. It supports DCA bots, grid bots, and SmartTrade workflows across multiple exchanges. Its AI assistant surfaces model-driven suggestions for entries, risk settings, and targets — but users must review and act on these themselves.

Best for: Experienced traders who want hands-on control. Not ideal for beginners — results depend heavily on the user’s own strategy quality, and misconfigured bots are a common cause of losses.

Verdict: Powerful for active traders. Too complex and high-maintenance for those seeking a passive AI trading bot experience.

Best for: Cost-conscious beginners wanting built-in bots on a single exchange

Pionex integrates trading bots directly into its exchange, eliminating the need for external API connections. Its PionexGPT feature allows plain-English strategy creation for basic automation. No subscription fees — only standard trading fees apply.

Best for: Casual crypto traders who want low-cost automated crypto trading with minimal overhead. Falls short as a true AI-driven risk management solution in volatile 2026 market conditions.

Verdict: A solid starting point for experimentation, but not a substitute for a platform with genuine quantitative strategy depth.

Best for: Traders who want a strategy marketplace and copy trading

Cryptohopper combines a visual Strategy Designer, a curated Marketplace of community strategies, and Social/copy trading in a cloud environment. Its Algorithm Intelligence feature can switch strategies automatically based on conditions.

Best for: Traders who want AI-assisted crypto automation with community strategy access. The open marketplace means strategy quality is uneven — beginners may struggle to identify what works.

Verdict: More flexible than most, but the burden of selecting good strategies still falls on the user.

Best for: Developers exploring experimental prototypes (not live trading)

In 2026, many traders still attempted to build a Claude AI trading bot or GPT-powered script from scratch using language model APIs. The appeal is obvious — but the execution is consistently problematic.

LLMs are not designed for real-time financial execution. They lack:

The result is typically an unreliable bot that generates inconsistent signals, requires constant debugging, and operates with no circuit breakers during drawdowns. Several 2026 trading communities have documented significant capital losses from poorly implemented DIY bots.

Best for: Technical experimentation only. Never recommended for live capital deployment without a full quantitative infrastructure built around the LLM layer.

Verdict: An interesting engineering exercise — not a viable AI day trading bot for consistent returns. Use purpose-built platforms like SaintQuant instead.

The strongest AI crypto trading platforms in 2026 share three qualities: they simplify strategy setup, include adaptive risk management, and operate continuously without requiring user intervention. Here is a quick decision framework:

SaintQuant’s AI quantitative strategies are live and ready. No setup, no coding, no deposit needed to begin.

New user bonuses — automatically credited on registration:

Start Trading Free at SaintQuant — No Deposit Required

Can I use Claude AI as a crypto trading bot? Claude is a conversational AI assistant — it is not built for live automated crypto execution. It lacks real-time exchange integrations and quantitative risk controls. For actual AI-powered day trading , purpose-built platforms like SaintQuant are far more reliable and safer to use with real capital.

What makes an AI day trading bot actually profitable in 2026? Profitability in 2026 depends on two things most bots still lack: battle-tested quantitative strategies and adaptive risk management. SaintQuant embeds both into every strategy, so users are not exposed to unchecked drawdowns during volatile markets.

Is SaintQuant free to try? Yes. New users receive a $99 free trial credit to run live strategies, plus a $7 cash bonus on registration — with no deposit required and no hidden terms.

Do I need coding skills or trading experience to use SaintQuant? None at all. SaintQuant is designed specifically for users who want automated crypto trading without any technical background. Strategies are pre-configured and start with a few clicks.

How is SaintQuant different from other AI trading bots in 2026? Most platforms require users to configure strategies, monitor performance, and manage risk manually. SaintQuant handles all of this automatically — including built-in risk controls — making it the closest thing to a fully managed AI crypto trading solution available to retail investors.

Disclosure: This content is provided by a third party. Neither crypto.news nor the author of this article endorses any product mentioned on this page. Users should conduct their own research before taking any action related to the company.",news:cryptonews,https://crypto.news/leading-ai-day-trading-bots-in-2026-why-most-fail-and-what-actually-works/,BTC,BTCUSDT,BTCUSDT,macro,observe,4,market_wide,high,high,true,include,,market_wide_event,115,"has_asset,has_binance_symbol,time_ok,typed_event,asset_confidence_high,time_confidence_high,importance_ge_4",include,high,2026-05-18T18:13:48Z,227.8964,mature_72h,true,conservative
cand_00347,2056452328039882780,2026-05-18T19:10:16Z,2026-05-19 03:10:16 UTC+8,2026-05-18T19:10:16Z,2026-05-19 03:10:16 UTC+8,,,,Asia/Shanghai,source_rule:webhook,,2026-05-19 03:10:16 UTC+8,2026-05-18T19:10:16Z,2026-05-19 03:10:16 UTC+8,published_at,Asia/Shanghai_for_naive_time,ok,,Cointelegraph：币安持有超过90亿美元比特币未平仓合约,币界网消息，据Cointelegraph报道，币安目前持有超过90亿美元的比特币未平仓合约，比其最近的竞争对手高出73%。,webhook,,BTC,BTCUSDT,BTCUSDT,macro,observe,4,market_wide,high,high,true,include,,market_wide_event,115,"has_asset,has_binance_symbol,time_ok,typed_event,asset_confidence_high,time_confidence_high,importance_ge_4",include,high,2026-05-18T19:10:16Z,226.9553,mature_72h,true,conservative
cand_00339,2056454065106698551,2026-05-18T19:17:10Z,2026-05-19 03:17:10 UTC+8,2026-05-18T19:17:10Z,2026-05-19 03:17:10 UTC+8,,,,Asia/Shanghai,source_rule:webhook,,2026-05-19 03:17:10 UTC+8,2026-05-18T19:17:10Z,2026-05-19 03:17:10 UTC+8,published_at,Asia/Shanghai_for_naive_time,ok,,JUST IN: Pro-Bitcoin Kevin Warsh to be sworn in as Federal Reserve Chair this Friday 👀🇺🇸 https://t.co/61p7sCHfHu,JUST IN: Pro-Bitcoin Kevin Warsh to be sworn in as Federal Reserve Chair this Friday 👀🇺🇸 https://t.co/61p7sCHfHu,webhook,,BTC,BTCUSDT,BTCUSDT,macro,observe,4,market_wide,high,high,true,include,,market_wide_event,115,"has_asset,has_binance_symbol,time_ok,typed_event,asset_confidence_high,time_confidence_high,importance_ge_4",include,high,2026-05-18T19:17:10Z,226.8403,mature_72h,true,conservative
cand_00329,2056457321799377121,2026-05-18T19:30:07Z,2026-05-19 03:30:07 UTC+8,2026-05-18T19:30:07Z,2026-05-19 03:30:07 UTC+8,,,,Asia/Shanghai,source_rule:webhook,,2026-05-19 03:30:07 UTC+8,2026-05-18T19:30:07Z,2026-05-19 03:30:07 UTC+8,published_at,Asia/Shanghai_for_naive_time,ok,,Messari报告：2026年Q1 Solana链上应用总收入达3.422亿美元,币界网消息，据Messari报告，2026年第一季度，Solana链上应用总收入（chain gdp）为3.422亿美元，其中Pumpfun收入达1.247亿美元，仍为收入最高的应用。同期，真实经济价值（rev）下降1%至8950万美元，在所有网络中仅次于Hyperliquid。同时，Solana DeFi TVL下降22%至61.6亿美元，主要受SOL价格下跌33%影响，而非用户流失所致。,webhook,,SOL,SOLUSDT,SOLUSDT,macro,observe,4,market_wide,high,high,true,include,,market_wide_event,115,"has_asset,has_binance_symbol,time_ok,typed_event,asset_confidence_high,time_confidence_high,importance_ge_4",include,high,2026-05-18T19:30:07Z,226.6244,mature_72h,true,conservative
cand_00303,news:1023:4e90951d1e9c8b40,2026-05-18T20:00:00Z,2026-05-19 04:00:00 UTC+8,2026-05-18T20:00:00Z,2026-05-19 04:00:00 UTC+8,,,,UTC,source_rule:news:cryptonews,,2026-05-19 04:00:00 UTC+8,2026-05-18T20:00:00Z,2026-05-19 04:00:00 UTC+8,published_at,Asia/Shanghai_for_naive_time,ok,,Kraken parent Payward grows Q1 revenue 3% as derivatives jump 51%,"Payward, Kraken’s parent, grew Q1 2026 adjusted revenue 3% to $507m as derivatives jumped 51%, even while Bitcoin, market cap and spot volumes all saw steep double‑digit drops.

Kraken parent Payward has posted Q1 2026 adjusted revenue of $507 million, a 3% increase from a year earlier, even as Bitcoin, total crypto market capitalization and industry spot volumes all suffered double-digit declines, according to CoinDesk. During the quarter, Bitcoin fell 22%, overall crypto market cap slid 23% and spot trading volume across the industry dropped 38%, underscoring how unusual it is for a major exchange group to grow topline in that environment.

The outperformance was driven in large part by derivatives, where Payward’s futures business saw daily average revenue trades jump 51% year-on-year. Management attributed that surge to the expansion of NinjaTrader and Breakout, as well as the broader build-out of Kraken’s derivatives franchise, which is increasingly offsetting cyclicality in spot trading.

Despite the revenue growth, adjusted EBITDA declined to $18 million in the quarter as the company leaned into spending. Payward said it is deliberately prioritizing mergers and acquisitions, product development and regulatory infrastructure over near-term profitability, characterizing the current bear-market stretch as the right time to invest.

The company’s strategic push appears to be translating into real market-share gains. Payward disclosed that Kraken ’s spot market share has climbed from about 3.5% in mid-2025 to 5.2% in March 2026, a meaningful jump in a market where incremental share is typically hard-won.

User metrics are also moving sharply higher: the number of funded accounts on Kraken grew 47% year-on-year to 6.1 million in Q1 2026, while total client assets on the platform rose to $40 billion. Co-CEO Arjun Sethi framed that performance as validation of the firm’s long-term strategy, saying, “While other companies choose to contract, we choose to continue investing.”

That stance stands in contrast to rivals that have cut headcount, scaled back product lines or pulled out of tougher regulatory jurisdictions over the past year. If the derivatives momentum and market-share gains continue, Payward’s decision to endure thinner EBITDA today in exchange for deeper global footprint and more diversified revenue streams could leave Kraken better positioned when the next upcycle in crypto volumes arrives.",news:cryptonews,https://crypto.news/kraken-parent-payward-grows-q1-revenue-3-as-derivatives-jump-51/,BTC,BTCUSDT,BTCUSDT,macro,observe,4,market_wide,high,high,true,include,,market_wide_event,115,"has_asset,has_binance_symbol,time_ok,typed_event,asset_confidence_high,time_confidence_high,importance_ge_4",include,high,2026-05-18T20:00:00Z,226.1264,mature_72h,true,conservative
cand_00304,news:1023:433959eb334ddec6,2026-05-18T20:00:00Z,2026-05-19 04:00:00 UTC+8,2026-05-18T20:00:00Z,2026-05-19 04:00:00 UTC+8,,,,UTC,source_rule:news:cryptonews,,2026-05-19 04:00:00 UTC+8,2026-05-18T20:00:00Z,2026-05-19 04:00:00 UTC+8,published_at,Asia/Shanghai_for_naive_time,ok,,Kraken revenue hits $507m in Q1 despite slump,"Kraken revenue rose 3% year-on-year to $507m in Q1 2026 as futures trading jumped 51%, Payward said Monday.

Payward, Kraken’s Wyoming-based parent company, said in a Monday press release that it generated $507 million in Q1 2026 adjusted revenue, up 3% from the same quarter a year earlier. Bitcoin fell 22% during the quarter and industry-wide spot trading volume dropped 38%, yet Payward’s diversified platform cushioned the decline.

A year earlier, Payward had reported $492 million in Q1 2025 adjusted revenue, making the 3% year-on-year gain notable given the steeper market downturn this cycle.

Co-CEO Arjun Sethi said in the release: “Where others pulled back, we leaned in.” Growth in futures and newer business lines offset weakness in core crypto markets, with Kraken’s spot market share rising to 5.2% in March from roughly 3.5% in mid-2025.

Rival platforms reported sharper declines in trading revenue over the same period. Payward attributed its resilience to its stronger institutional business and growing derivatives offering, built partly through its $550 million acquisition of CFTC-licensed platform Bitnomial, which crypto.news covered when the deal completed on May 4.

Total platform transaction volume reached $357 billion in Q1, while funded accounts rose 47% year-on-year to 6.1 million and assets on platform reached $40 billion.

Adjusted EBITDA fell to $18 million as Payward continued investing in acquisitions including tokenization platform Backed, token management firm Magna, Bitnomial, and payments company Reap.

Crypto.news reported that non-trading revenue sources including custody, payments, and financing accounted for 53% of Payward’s 2025 total, a structural shift that reduces dependence on volatile trading volumes.

Payward filed its draft S-1 with the SEC confidentially in November 2025 but paused the process in March, citing market conditions. Sources indicate a public listing may slip to 2027. The exchange also cut approximately 150 employees in May, attributing the reductions to AI-driven operational efficiencies, representing roughly 5% of its total workforce.

Payward’s M&A push positions it as the most comprehensively regulated crypto derivatives platform in the US. Crypto.news documented how the Bitnomial deal and Deutsche Börse’s $200 million stake established Payward as a regulated hub for digital asset futures and options inside the US, with its IPO filing remaining active.",news:cryptonews,https://crypto.news/kraken-revenue-hits-507m-in-q1-despite-slump/,BTC,BTCUSDT,BTCUSDT,macro,observe,4,market_wide,high,high,true,include,,market_wide_event,115,"has_asset,has_binance_symbol,time_ok,typed_event,asset_confidence_high,time_confidence_high,importance_ge_4",include,high,2026-05-18T20:00:00Z,226.1264,mature_72h,true,conservative
cand_00277,news:3001:a7503ed9fe87c295,2026-05-18T20:28:40Z,2026-05-19 04:28:40 UTC+8,2026-05-18T20:28:40Z,2026-05-19 04:28:40 UTC+8,,,,Asia/Shanghai,source_rule:tg:,,2026-05-19 04:28:40 UTC+8,2026-05-18T20:28:40Z,2026-05-19 04:28:40 UTC+8,published_at,Asia/Shanghai_for_naive_time,ok,,【知名交易员Loracle「 HYPE 空仓 TOP 1」】SNDK 空单 平仓止盈!,"🏛️ 链上华尔街速报 | 巨鲸平仓提醒 💸
📅 时间: 2026/5/19 04:28:39
🐳 【知名交易员Loracle「 HYPE 空仓 TOP 1」】SNDK 空单 平仓止盈!
💵 SNDK空单已完全平仓
 ✦ 平仓前持仓规模: 3,368,542.54美元
📌 地址: 0x8def9f50456c6c4e37fa5d3d57f108ed23992dae
🔥 注: Loracle （X：loraclexyz）原名 Laurent Zeimes。其在 Hyperliquid 生态里活跃，被视为早期贡献者之一，系Hypurrfun创始人，月盈1600万美元。 🔥
Hyperliquid 官网查看:https://app.hyperliquid.xyz/",tg:HyperInsight,https://t.me/HyperInsight/88740,HYPE,,HYPEUSDT,macro,observe,4,market_wide,high,high,true,include,,market_wide_event,115,"has_asset,has_binance_symbol,time_ok,typed_event,asset_confidence_high,time_confidence_high,importance_ge_4",include,high,2026-05-18T20:28:40Z,225.6486,mature_72h,true,conservative
cand_00253,news:1023:a107c66a5b937a7d,2026-05-18T21:00:00Z,2026-05-19 05:00:00 UTC+8,2026-05-18T21:00:00Z,2026-05-19 05:00:00 UTC+8,,,,UTC,source_rule:news:cryptonews,,2026-05-19 05:00:00 UTC+8,2026-05-18T21:00:00Z,2026-05-19 05:00:00 UTC+8,published_at,Asia/Shanghai_for_naive_time,ok,,HIVE soars over 35% on plans for $2.55b Toronto AI 'super factory',"HIVE Digital is pivoting from Bitcoin mining to a CAD 3.5b, 320 MW Toronto AI “super factory” hosting 100,000+ GPUs, sending its stock up over 35% on the news.

HIVE Digital Technologies, long known as a Bitcoin ( BTC ) mining company, has unveiled plans for a 320 MW AI infrastructure park in the Greater Toronto Area, a move that sent its shares up more than 35% at the open after the news broke on Monday, according to The Block. The company described the project as an AI “super factory” and said it aims to create one of Canada’s largest sovereign AI campuses at a time when demand for data center power and GPUs is exploding.

HIVE said the buildout will be led by its high‑performance computing subsidiary BUZZ, with total capital expenditure expected to reach roughly CAD 3.5 billion, or about $2.55 billion at current exchange rates. Once fully completed, the site is expected to support more than 100,000 GPUs across multiple large‑scale data halls dedicated to training and running AI models, putting the project in the same power class as some US hyperscale campuses.

The company is targeting the second half of 2027 for initial operations at the Toronto‑area AI park, suggesting a multi‑year construction and power‑procurement timeline that aligns with typical hyperscale data center projects. Management framed the site as “sovereign” AI infrastructure, signaling that HIVE wants to position the campus as a Canadian‑controlled alternative to US cloud and chip majors for governments, enterprises, and local AI startups.

HIVE did not disclose detailed financing plans in the initial announcement but indicated the CAD 3.5 billion budget includes land, power infrastructure, cooling, data center construction, and GPU hardware. Given the scale, the company is likely to lean on a mix of equity, debt, and potential partnerships with hardware vendors or cloud customers to lock in anchor tenants ahead of the 2027 launch.

The Toronto project marks the most aggressive step yet in HIVE’s ongoing shift away from pure Bitcoin mining toward AI and high‑performance computing infrastructure. In recent years, the firm has expanded GPU clusters and AI‑oriented data center operations in Paraguay and Sweden, effectively using its expertise in energy‑intensive mining to bootstrap a different kind of compute business.

That strategic pivot has taken place against a backdrop of rising competition and margin compression in Bitcoin mining, while GPU‑rich AI infrastructure has become one of the hottest capital‑markets stories of the cycle. By tying its future to a 320 MW “super factory” capable of hosting over 100,000 GPUs on Canadian soil, HIVE is betting that investors will reward it more as an AI data center operator than as a cyclical crypto miner — a bet Monday’s 35%+ share price pop suggests the market is, at least initially, willing to entertain.",news:cryptonews,https://crypto.news/hive-soars-over-35-on-plans-for-2-55b-toronto-ai-super-factory/,BTC,BTCUSDT,BTCUSDT,macro,observe,4,market_wide,high,high,true,include,,market_wide_event,115,"has_asset,has_binance_symbol,time_ok,typed_event,asset_confidence_high,time_confidence_high,importance_ge_4",include,high,2026-05-18T21:00:00Z,225.1264,mature_72h,true,conservative
cand_00251,2056480194676842790,2026-05-18T21:01:00Z,2026-05-19 05:01:00 UTC+8,2026-05-18T21:01:00Z,2026-05-19 05:01:00 UTC+8,,,,Asia/Shanghai,source_rule:webhook,,2026-05-19 05:01:00 UTC+8,2026-05-18T21:01:00Z,2026-05-19 05:01:00 UTC+8,published_at,Asia/Shanghai_for_naive_time,ok,,"The two largest corporate holders of Bitcoin:

Strategy - 843,738 BTC
BlackRock - 817,138 BTC

Who will win the race to","The two largest corporate holders of Bitcoin:

Strategy - 843,738 BTC
BlackRock - 817,138 BTC

Who will win the race to 1,000,000 BTC? https://t.co/IaZrcpFeYI",webhook,,BTC,BTCUSDT,BTCUSDT,macro,observe,4,market_wide,high,high,true,include,,market_wide_event,115,"has_asset,has_binance_symbol,time_ok,typed_event,asset_confidence_high,time_confidence_high,importance_ge_4",include,high,2026-05-18T21:01:00Z,225.1097,mature_72h,true,conservative
cand_00239,news:3001:c1a435dd4474c1cf,2026-05-18T21:12:40Z,2026-05-19 05:12:40 UTC+8,2026-05-18T21:12:40Z,2026-05-19 05:12:40 UTC+8,,,,Asia/Shanghai,source_rule:tg:,,2026-05-19 05:12:40 UTC+8,2026-05-18T21:12:40Z,2026-05-19 05:12:40 UTC+8,published_at,Asia/Shanghai_for_naive_time,ok,,【知名交易员Loracle「 HYPE 空仓 TOP 1」】HYPE 空单 摊平 啦!,"🚀 Hyperliquid 持仓异动 | 主力巨鲸大单提醒 🚀
📅 时间: 2026/5/19 05:12:39
🐳 【知名交易员Loracle「 HYPE 空仓 TOP 1」】HYPE 空单 摊平 啦!
💰 HYPE空单增持 16,935.31 枚, 约合2,852,244.46美元
▫️ 持仓规模: 63,516,416.17美元
▫️ 均价: 42.08美元 → 42.15美元
▫️ 当前盈亏: -6,914,710.04美元 (-54.43%)
▫️ 当前币价: 47.30美元
▫️ 清算价: 71.42美元
📌 地址: 0x8def9f50456c6c4e37fa5d3d57f108ed23992dae
🔥 注: Loracle （X：loraclexyz）原名 Laurent Zeimes。其在 Hyperliquid 生态里活跃，被视为早期贡献者之一，系Hypurrfun创始人，月盈1600万美元。 🔥
Hyperliquid 官网查看:https://app.hyperliquid.xyz/",tg:HyperInsight,https://t.me/HyperInsight/88742,HYPE,,HYPEUSDT,macro,observe,4,market_wide,high,high,true,include,,market_wide_event,115,"has_asset,has_binance_symbol,time_ok,typed_event,asset_confidence_high,time_confidence_high,importance_ge_4",include,high,2026-05-18T21:12:40Z,224.9153,mature_72h,true,conservative
