event_id,event_time,event_time_utc,event_time_china,title,content,source,asset_symbol,binance_spot_symbol,binance_futures_symbol,event_type,event_subtype,source_type,direction_hint,importance
cand_01648,2026-05-20 15:01:57 UTC+8,2026-05-20T07:01:57Z,2026-05-20 15:01:57 UTC+8,GitHub Internal Repositories Breached via VS Code Extension,"GitHub Internal Repositories Breached via VS Code Extension Ecosystem English News Markets Features Learn Sponsored About LINK $9.61 1.77% TRX $0.3564 0.09% BCH $370.16 2.96% DOGE $0.1038 0.75% ZEC $586.33 2.98% ETH $2,131 0.34% BNB $644.06 0.01% SOL $84.87 0.59% HYPE $48.53 1.16% XMR $395.86 1.88% XRP $1.36 1.18% ADA $0.2496 1.03% BTC $77,369 0.32% Written by Martin Young ⁠, Staff Writer. Reviewed by Felix Ng ⁠, Staff Editor. Written by Martin Young ⁠, Staff Writer. Reviewed by Felix Ng ⁠, Staff Editor. GitHub investigates unauthorized access to internal repositories Latest News Published May 20, 2026 GitHub said the activity involved the exfiltration of about 3,800 internal repositories, and it removed the malicious code extension. GitHub said on Wednesday it is investigating unauthorized access to its internal repositories following the compromise of an employee's device. “While we currently have no evidence of impact to customer information stored outside of GitHub’s internal repositories, we are closely monitoring our infrastructure for follow-on activity,” the developer platform said in a statement. In a subsequent post, GitHub said it detected and contained a compromise of an employee device involving a poisoned VS Code extension on Tuesday. “We removed the malicious extension version, isolated the endpoint, and began incident response immediately,” it added. GitHub is the go-to platform for developers, many of whom host their open source projects and repositories on its servers. TeamPCP claims responsibility Meanwhile, a hacking group called TeamPCP has reportedly claimed responsibility for the compromise and has attempted to sell the GitHub data online, claiming to have “4,000 repos of private code” related to GitHub’s main platform and internal organizations. TeamPCP is a sophisticated, automation-heavy hacking group that turns compromised developer tools into credential-harvesting machines for financial gain, SecurityWeek reported . TeamPCP claims responsibility on underground hacker forums. Source: Hackmanac “If you have API keys in your code, even private repos, now is the time to double-check and change them,” Binance founder Changpeng Zhao said . Related: Hackers used AI to craft zero-day attack to bypass 2FA: Google It comes just a day after Grafana Labs, an open-source data observability company, said on Tuesday it was hit by a supply-chain attack in which malicious actors accessed its GitHub repositories and downloaded its codebase. The attackers issued a ransom demand under threat of data disclosure, which the firm did not meet. This incident also came shortly after the April 28 public disclosure of a critical remote code execution vulnerability, CVE-2026-3854, that allowed authenticated users to execute arbitrary commands on GitHub’s servers. Wiz Research, which discovered the critical flaw, reported at the time that millions of public and private repositories belonging to other users and organizations were accessible on the affected nodes. Magazine: DeFi’s billion-dollar secret: The insiders responsible for hacks Cointelegraph is committed to independent, transparent journalism. This news article is produced in accordance with Cointelegraph’s Editorial Policy and aims to provide accurate and timely information. Readers are encouraged to verify information independently. Developers Hacks Cybercrime Scams & Cybercrime More on the subject Echo Protocol's eBTC exploited for $77M in admin key compromise May 19, 2026 Martin Young US law firm files motion requesting redistribution of $344M USDt linked to Iran May 15, 2026 Vince Quill THORChain pauses trading after suspected $10M exploit May 15, 2026 Zoltan Vardai Echo Protocol's eBTC exploited for $77M in admin key compromise May 19, 2026 Martin Young US law firm files motion requesting redistribution of $344M USDt linked to Iran May 15, 2026 Vince Quill THORChain pauses trading after suspected $10M exploit May 15, 2026 Zoltan Vardai News Latest News Markets Bitcoin Ethereum Altcoins Blockchain Regulation Sponsored Sponsored Articles Press Releases Research Ecosystem Magazine Accelerator Events Decentralization Guardians LONGITUDE Event About About Cointelegraph Editorial Policy Ads Disclosure Financial Risk Disclaimer Cointelegraph is committed to providing independent, high-quality journalism across the crypto, blockchain, AI, and fintech industries. All news, reviews, and analyses are produced with full journalistic independence and integrity. For more details on our standards and processes, please read our Editorial Policy . © Cointelegraph 2013 - 2026 Terms of Service and Privacy Policy",news:cointelegraph,ADA,ADAUSDT,ADAUSDT,hack_security,exploit_or_theft,news:cointelegraph,risk,4
cand_01626,2026-05-20 15:30:16 UTC+8,2026-05-20T07:30:16Z,2026-05-20 15:30:16 UTC+8,Trump Media’s Truth Social Withdraws Bitcoin ETF Filing,"Trump Media’s Truth Social Withdraws Bitcoin ETF Filing Press Releases Submit a press release Read All Contact us Advertise No Result View All Result Bitcoin News Price Businesses Acceptance Technology Investment Regulation Reviews All Bitcoin News Altcoins News Price Ethereum Ripple Litecoin EOS NAGA All Altcoin News Tech Blockchain Security FinTech Price Bitcoin Price Ethereum Price Binance Coin Price Litecoin Price Industry Industry News Press Releases How to Buy gift cards/mobile Top Ups with Cryptos What Is Bitcoin? Best Bitcoin Wallet Bitcoin vs Ethereum Why Use Blockchain Technology? Bitcoin Cash ABC vs. Bitcoin Cash SV How to Buy Cryptocurrency How to do Crypto Gambling Crypto Casinos Ethereum Casinos Solana Casinos LiteCoin Casinos DogeCoin Casinos Live Crypto Casinos New Casinos Instant Withdrawal Casinos Cash App Casinos No KYC Casinos VPN Casinos Offshore Casinos Crypto Casinos IT Crypto Casinos ES All Guides Crypto Casinos JP Crypto Casinos SG Crypto Casinos MY Crypto Casinos KR No GAMSTOP Casinos in UK No Cruks Casinos NL Crypto Betting No ID sportsbooks Play Crypto Games Crypto Poker Crypto Slots Crypto Blackjack Crypto Crash Gambling Aviator Sites Plinko Bitcoin Mining Best Bitcoin Brokers Best Bitcoin Forex Brokers How To Earn Bitcoin What is Facebook Libra? Ripple and XRP: The Complete Guide Events Play Games Breaking News: XRP Ledger Announces Quantum-Era Partnership: Project Eleven Teams With Ripple Bitcoin News Price Businesses Acceptance Technology Investment Regulation Reviews All Bitcoin News Altcoins News Price Ethereum Ripple Litecoin EOS NAGA All Altcoin News Tech Blockchain Security FinTech Price Bitcoin Price Ethereum Price Binance Coin Price Litecoin Price Industry Industry News Press Releases How to Buy gift cards/mobile Top Ups with Cryptos What Is Bitcoin? Best Bitcoin Wallet Bitcoin vs Ethereum Why Use Blockchain Technology? Bitcoin Cash ABC vs. Bitcoin Cash SV How to Buy Cryptocurrency How to do Crypto Gambling Crypto Casinos Ethereum Casinos Solana Casinos LiteCoin Casinos DogeCoin Casinos Live Crypto Casinos New Casinos Instant Withdrawal Casinos Cash App Casinos No KYC Casinos VPN Casinos Offshore Casinos Crypto Casinos IT Crypto Casinos ES All Guides Crypto Casinos JP Crypto Casinos SG Crypto Casinos MY Crypto Casinos KR No GAMSTOP Casinos in UK No Cruks Casinos NL Crypto Betting No ID sportsbooks Play Crypto Games Crypto Poker Crypto Slots Crypto Blackjack Crypto Crash Gambling Aviator Sites Plinko Bitcoin Mining Best Bitcoin Brokers Best Bitcoin Forex Brokers How To Earn Bitcoin What is Facebook Libra? Ripple and XRP: The Complete Guide Events Play Games No Result View All Result Breaking News: XRP Ledger Announces Quantum-Era Partnership: Project Eleven Teams With Ripple Trump Media’s Truth Social Withdraws Bitcoin ETF Filing by Jake Simmons Last Updated: May 20, 2026 2:30 am · Posted in Bitcoin News Trusted Editorial content, reviewed by leading industry experts and seasoned editors. Ad Disclosure Trump Media-linked Truth Social Bitcoin ETF, B.T. has asked the US Securities and Exchange Commission to withdraw its spot Bitcoin ETF registration, ending, at least for now, one of the more politically visible attempts to enter the already crowded US Bitcoin fund market. The withdrawal request , dated May 19, 2026, was addressed to the SEC’s Division of Corporation Finance and its Office of Crypto Assets. In the filing, the company requested “the immediate withdrawal” of its Form S-1 registration statement, which had originally been filed on June 5, 2025, under File No. 333-287789. The company said the registration statement had not been declared effective and confirmed that “no securities have been sold” under it. “The Company has determined to withdraw the Registration Statement and not to pursue the public offering at this time,” the filing stated. “The Registration Statement has not been declared effective by the Commission and the Company confirms that no securities have been sold pursuant to the Registration Statement. Therefore, withdrawal of the Registration Statement is consistent with the public interest and the protection of investors as contemplated by Rule 477(a).” Related Reading: Bitcoin Supply In Profit Jumps To 63%: Why Analysts Are Still Cautious The filing closes a nearly year-long regulatory process that began shortly after NYSE Arca submitted a Form 19b-4 to list the Truth Social Bitcoin ETF on June 3, 2025. That exchange filing described the proposed product as a vehicle designed to reflect Bitcoin’s performance while reducing the “complexities and operational burdens” of direct BTC ownership. Reuters reported at the time that US President Donald Trump was the majority owner of Trump Media & Technology Group, which operates Truth Social. The ETF’s S-1 described Truth Social Bitcoin ETF, B.T. as a Nevada business trust whose assets would consist primarily of Bitcoin held by a custodian. Yorkville America Digital, LLC was named as sponsor, while Foris DAX Trust Company, LLC, a Crypto.com affiliate, was listed as Bitcoin custodian in the initial registration statement. The trust was not registered under the Investment Company Act of 1940 and was structured as a Securities Act of 1933 product, the same broad framework used by spot Bitcoin ETPs rather than traditional ’40 Act ETFs. Trump Media later amended the filing in August 2025, saying Crypto.com would act as the ETF’s exclusive Bitcoin custodian, prime execution agent and liquidity provider. The company said at the time that the launch remained subject to both effectiveness of the S-1 and SEC approval of the related 19b-4 filing, with shares expected to list on NYSE Arca if approved. Why Was The Bitcoin ETF Withdrawn? Yorkville America framed the withdrawal as a strategic pivot rather than a retreat from ETFs. In a May 19 press release, the firm said it had “proactively withdrawn its registration statements filed under the Securities Act of 1933” for certain planned ETF strategies and would instead focus product development under the ’40 Act framework. “After careful evaluation, the ’40 Act structure allows us to bring more differentiated investment strategies to our investors that are not possible under the ’33 Act framework,” Yorkville America President Steve Neamtz said. “Our focus has always been on delivering the right strategies through the right structures. This is a forward-looking decision that reflects our commitment to delivering the best possible investment products to our growing base of America First investors. Yorkville America is not stepping back – we are stepping forward with a stronger product platform.” Related Reading: Strategy Acquires 24,869 Bitcoin In Massive $2 Billion Buy Bloomberg ETF analyst James Seyffart was unconvinced by that explanation. Sharing a screenshot of the withdrawal on X, he wrote that the reasoning “doesn’t make a ton of sense,” noting that the difference between a ’33 Act exchange-traded product and a ’40 Act ETF was already well understood in the market. Seyffart said he suspected the decision had more to do with the “competitive landscape for spot bitcoin ETFs,” especially with Morgan Stanley’s MSBT entering at 14 basis points. He added: “They do seem to planning to launch more flexible crypto related ETF strategies in the 40 act wrapper which makes sense. I mean do we really need a 14th spot bitcoin ETF? But something that can be more differentiated makes sense.” Bloomberg ETF analyst Eric Balchunas agreed via X: “My guess: Yorkville guy told Truth ppl after MSBT that they either gotta come in below 14bp fee or you might as well forget it, bc no one will buy it, and it could be embarrassing. They aren’t used to Terrordome life so prob said “no way are we charging so little” Could be wrong but that’s my theory for now.” That fee pressure is material. Morgan Stanley’s proposed spot Bitcoin fund was priced at 14 basis points, below products charging closer to 15 to 25 basis points, including BlackRock’s iShares Bitcoin Trust at 25 basis points. At press time, BTC traded at $77,274. Bitcoin falls below the 20-week EMA, 1-week chart | Source: BTCUSDT on TradingView.com Featured image created with DALL.E, chart from TradingView.com Editorial Process for bitcoinist is centered on delivering thoroughly researched, accurate, and unbiased content. We uphold strict sourcing standards, and each page undergoes diligent review by our team of top technology experts and seasoned editors. This process ensures the integrity, relevance, and value of our content for our readers. Share Tweet Share Share Sign Up for Our Newsletter! For updates and exclusive offers enter your email. Sign Up I consent to my submitted data being collected and stored. Leave this field empty if you're human: Jake Simmons Follow Jake Simmons has been a Bitcoin enthusiast since 2016. Ever since he heard about Bitcoin, he has been studying the topic every day and trying to share his knowledge with others. His goal is to contribute to Bitcoin's financial revolution, which will replace the fiat money system. Besides BTC and crypto, Jake studied Business Informatics at a university. After graduation in 2017, he has been working in the blockchain and crypto sector. You can follow Jake on Twitter at @realJakeSimmons. Full Profile Related Posts Bitcoin Supply In Profit Jumps To 63%: Why Analysts Are Still Cautious 4 hours ago Bitcoin Is Trapped Between Two Powerful Holder Levels: Key Data Clears The Setup 5 hours ago Bitcoin Rally Triggered Fastest Futures Open Interest Growth Of 2026: CryptoQuant 7 hours ago Strategy Acquires 24,869 Bitcoin In Massive $2 Billion Buy 23 hours ago Bitcoin Retail Activity Hits Record Low As Binance Inflows Plunge 1 day ago Bitcoin And Ethereum Hit By $2.2B In Sell Pressure: Analyst Explains Coordinated Market Selloff 1 day ago Premium Sponsors Press Releases Wadoozie Pays You for Puzzles and Content – Here’s... 4 minutes ago Bitcoin Poker Site CoinPoker Joins Triton Montenegro 2026... 20 hours ago Best Crypto to Buy Before Exchange Listings? Divine Ray... 4 days ago Binance Moves Toward Autonomous Crypto Trading with Launch... 5 days ago 알트코인 모멘텀 부활… 20% 급등한... 6 days ago Bitcoin news portal providing breaking news, guides, price analysis about decentralized digital money & blockchain technology. Bitcoin News Price Businesses Acceptance Technology Investment Regulation Reviews Altcoins News Price Ethereum Ripple Litecoin EOS Categories Blockchain Security FinTech Technology Trending Breaking News Press Releases How to About Us Advertise Contact us Editorial Policy Privacy Policy © 2026 Bitcoinist.com . All Rights Reserved. Bitcoin News Price Businesses Acceptance Technology Investment Regulation Reviews All Bitcoin News Altcoins News Price Ethereum Ripple Litecoin EOS NAGA All Altcoin News Tech Blockchain Security FinTech Price Bitcoin Price Ethereum Price Binance Coin Price Litecoin Price Industry Industry News Press Releases How to Buy gift cards/mobile Top Ups with Cryptos What Is Bitcoin? Best Bitcoin Wallet Bitcoin vs Ethereum Why Use Blockchain Technology? Bitcoin Cash ABC vs. Bitcoin Cash SV How to Buy Cryptocurrency How to do Crypto Gambling Crypto Casinos Crypto Betting Play Crypto Games Crypto Poker Crypto Slots Crypto Blackjack Crypto Crash Gambling Plinko Bitcoin Mining Best Bitcoin Brokers Best Bitcoin Forex Brokers How To Earn Bitcoin What is Facebook Libra? Ripple and XRP: The Complete Guide Events Play Games Advertise © 2025 Bitcoinist . All Rights Reserved. This website uses cookies. By continuing to use this website you are giving consent to cookies being used. Visit our Privacy Center or Cookie Policy . I Agree",news:bitcoinist,BNB,BNBUSDT,BNBUSDT,institutional_flow,etf_or_fund_flow,news:bitcoinist,observe,4
cand_01571,2026-05-20 16:44:53 UTC+8,2026-05-20T08:44:53Z,2026-05-20 16:44:53 UTC+8,SEC Chair Paul Atkins Signals a New Era for Crypto — XRP Leads the Conversation,"SEC’s Paul Atkins hints at a new crypto vault framework, marking a move toward structured yield rules with these remarks putting XRP in a strong position.

As Washington signals a shift from crypto crackdowns toward formal rulemaking, a new concept is quietly moving into focus entailing crypto vaults.

As a result, digital asset research firm Evernorth argues this transition could have significant implications for XRP and the XRP Ledger.

Earlier this month, Paul S. Atkins drew a direct parallel between today’s digital asset landscape and the pre-1998 era before Regulation ATS redefined electronic trading, bringing it out of regulatory ambiguity and into Wall Street’s formal structure.

In the same remarks, he specifically pointed to crypto vaults, signaling a potential move by the SEC toward formally defining blockchain-based yield products as a distinct regulatory category rather than continuing to address them primarily through enforcement.

This distinction matters because a crypto vault is simply a pooled deposit system that executes predefined on-chain strategies such as yield generation, liquidity management, or treasury allocation.

In most DeFi environments today, these vaults are built on top of multiple smart contracts layered over a base blockchain, which can add complexity and additional points of risk.

The difference with the XRP Ledger is that this functionality is being brought into the protocol itself through XLS-66. Instead of relying on external DeFi stacks, vault mechanics are embedded directly into the ledger.

This shift reduces fragmentation and standardizes execution at the base layer, creating a more predictable environment for structured strategies. For institutions, it means access to on-chain yield and asset management tools without the usual dependency on layered, third-party infrastructure.

For traditional finance institutions, this distinction is critical since they tend to favor systems that are auditable, deterministic, and embedded at the protocol level, rather than fragmented applications built across multiple smart contracts.

Native vault architecture reduces operational complexity and attack surfaces, making it a far more compelling fit for regulated financial environments.

This is where the Regulation ATS comparison becomes particularly relevant. Before ATS, electronic trading venues operated in regulatory ambiguity.

Once a clear framework was introduced, institutional capital entered at scale and reshaped the market. Crypto vaults could be moving along a similar path, shifting from experimental DeFi structures to formally recognized pieces of financial infrastructure.

If that trajectory holds, XRP may already be positioned ahead of the curve. For years, Ripple has positioned the XRP Ledger around institutional-grade use cases , such as compliant payments, liquidity provisioning, tokenization, and cross-border settlement. While many crypto ecosystems evolved from open experimentation toward compliance, the XRPL was designed with institutional interoperability in mind from the outset.

The XRPL architecture is increasingly aligned with the regulatory direction taking shape.

According to on-chain analytics provider RippleXity, the XRP Ledger is being viewed as a settlement infrastructure that already maps to key requirements in regulated capital markets.

As conversations around tokenized equities and blockchain-based financial rails mature, the focus is shifting away from long-term potential and toward which networks already meet institutional-grade standards today.

Liquidity further reinforces this argument because unlike newer blockchains that rely on fragmented external liquidity solutions, the XRP Ledger integrates a native decentralized exchange and central limit order book at the protocol level.

As a result, this built-in liquidity layer becomes especially significant as tokenized assets and on-chain treasury products move toward regulated, large-scale adoption within established legal frameworks.

Meanwhile, the broader narrative is shifting in parallel. Ripple’s climb to 16th on CNBC’s Disruptor 50 signals growing recognition that the real battleground in blockchain is financial infrastructure, not just the trading aspect.

If the SEC ultimately defines a formal category for crypto vaults, XRP could stand to benefit not by chasing the trend, but because much of the infrastructure regulators are beginning to describe what already exists on the XRP Ledger.

Don’t miss out and join our newsletter to get the latest, well-curated news from the crypto world!

Brian Njuguna is a seasoned crypto journalist at Coinpaper, specializing in blockchain innovation, market trends, and regulatory developments. With a background in economics and years of experience covering the digital asset space, Brian delivers sharp, data-driven insights that cut through the hype. His reporting bridges global crypto narratives with emerging market perspectives, making complex topics accessible to a wide audience.

https://coinpaper.com/17152/sec-chair-paul-atkins-signals-a-new-era-for-crypto-xrp-leads-the-conversation",news:coinpaper,HYPE,,HYPEUSDT,hack_security,exploit_or_theft,news:coinpaper,risk,4
