event_id,event_time,event_time_utc,event_time_china,title,content,source,asset_symbol,binance_spot_symbol,binance_futures_symbol,event_type,event_subtype,source_type,direction_hint,importance
cand_00218,2026-05-21 15:00:13 UTC+8,2026-05-21T07:00:13Z,2026-05-21 15:00:13 UTC+8,Bitcoin Quantum Exposure: Glassnode Says 30% of Supply Is Highly Vulnerable | Bitcoinist.com,"Bitcoin Quantum Exposure: Glassnode Says 30% of Supply Is Highly Vulnerable | Bitcoinist.com Press Releases Submit a press release Read All Contact us Advertise No Result View All Result Bitcoin News Price Businesses Acceptance Technology Investment Regulation Reviews All Bitcoin News Altcoins News Price Ethereum Ripple Litecoin EOS NAGA All Altcoin News Tech Blockchain Security FinTech Price Bitcoin Price Ethereum Price Binance Coin Price Litecoin Price Industry Industry News Press Releases How to Buy gift cards/mobile Top Ups with Cryptos What Is Bitcoin? Best Bitcoin Wallet Bitcoin vs Ethereum Why Use Blockchain Technology? Bitcoin Cash ABC vs. Bitcoin Cash SV How to Buy Cryptocurrency How to do Crypto Gambling Crypto Casinos Ethereum Casinos Solana Casinos LiteCoin Casinos DogeCoin Casinos Live Crypto Casinos New Casinos Instant Withdrawal Casinos Cash App Casinos No KYC Casinos VPN Casinos Offshore Casinos Crypto Casinos IT Crypto Casinos ES All Guides Crypto Casinos JP Crypto Casinos SG Crypto Casinos MY Crypto Casinos KR No GAMSTOP Casinos in UK No Cruks Casinos NL Crypto Betting No ID sportsbooks Play Crypto Games Crypto Poker Crypto Slots Crypto Blackjack Crypto Crash Gambling Aviator Sites Plinko Bitcoin Mining Best Bitcoin Brokers Best Bitcoin Forex Brokers How To Earn Bitcoin What is Facebook Libra? Ripple and XRP: The Complete Guide Events Play Games Breaking News: US Treasury Cracks Down Drug Lord’s Crypto Money-Laundering Ring Linked To Sinaloa Cartel Bitcoin News Price Businesses Acceptance Technology Investment Regulation Reviews All Bitcoin News Altcoins News Price Ethereum Ripple Litecoin EOS NAGA All Altcoin News Tech Blockchain Security FinTech Price Bitcoin Price Ethereum Price Binance Coin Price Litecoin Price Industry Industry News Press Releases How to Buy gift cards/mobile Top Ups with Cryptos What Is Bitcoin? Best Bitcoin Wallet Bitcoin vs Ethereum Why Use Blockchain Technology? Bitcoin Cash ABC vs. Bitcoin Cash SV How to Buy Cryptocurrency How to do Crypto Gambling Crypto Casinos Ethereum Casinos Solana Casinos LiteCoin Casinos DogeCoin Casinos Live Crypto Casinos New Casinos Instant Withdrawal Casinos Cash App Casinos No KYC Casinos VPN Casinos Offshore Casinos Crypto Casinos IT Crypto Casinos ES All Guides Crypto Casinos JP Crypto Casinos SG Crypto Casinos MY Crypto Casinos KR No GAMSTOP Casinos in UK No Cruks Casinos NL Crypto Betting No ID sportsbooks Play Crypto Games Crypto Poker Crypto Slots Crypto Blackjack Crypto Crash Gambling Aviator Sites Plinko Bitcoin Mining Best Bitcoin Brokers Best Bitcoin Forex Brokers How To Earn Bitcoin What is Facebook Libra? Ripple and XRP: The Complete Guide Events Play Games No Result View All Result Breaking News: US Treasury Cracks Down Drug Lord’s Crypto Money-Laundering Ring Linked To Sinaloa Cartel Bitcoin Quantum Exposure: Glassnode Says 30% of Supply Is Highly Vulnerable by Ronaldo Marquez Last Updated: May 21, 2026 2:00 am · Posted in Bitcoin News Trusted Editorial content, reviewed by leading industry experts and seasoned editors. Ad Disclosure A new study by Glassnode is putting fresh focus on a security risk for the wider Bitcoin (BTC) ecosystem—one that relates not to today’s cryptography, but to what could happen if quantum computers become powerful enough to run the right algorithms. According to the research , 6.04 million Bitcoin, or 30.2% of the issued supply, is exposed under an “at-rest” model that looks for whether public-key material is already visible on-chain. The remaining 13.99 million BTC, representing 69.8% of the supply, is described as showing no public-key exposure at rest Structural Vs. Operational Exposure Glassnode breaks the concern into two distinct categories: structural exposure and operational exposure. Structural exposure covers outputs where the script type itself reveals the public key by design. Operational exposure is different. It refers to coins that may have been protected originally, but where address reuse, partial spending, or custody behavior has already made the public key visible—while the BTC remains tied to the same address, key, or script structure. Related Reading: XRP Ledger Announces Quantum-Era Partnership: Project Eleven Teams With Ripple In the study’s breakdown, structural exposure accounts for 1.92 million BTC, equal to 9.6% of issued supply. Operational exposure is larger, totaling 4.12 million BTC, or 20.6%. Within this operational bucket, exchange-related balances alone come to 1.63 million BTC, or 8.1% of all issued Bitcoin. The quantum risk behind the analysis is rooted in a scenario involving a sufficiently capable “Cryptographically Relevant Quantum Computer” (CRQC) running Shor’s algorithm. In principle, if an attacker knows a public key, Shor’s algorithm could be used to recover the corresponding private key. Glassnode’s at-rest framework matters here because the attacker would not need the owner to move the coins. If the public key is already visible on-chain, the coin is considered exposed; if the public key is not visible on-chain, the coin is not exposed under this specific model. The Bigger Warning Under Glassnode’s structural exposure definition, the output type itself reveals the relevant public-key information, independent of how carefully the owner manages addresses. The report points to early P2PK outputs—associated with Satoshi-era coins —and legacy bare multisig structures such as P2MS. It also includes modern Taproot (P2TR) outputs. While these script types come from different eras and were built for different purposes, they share the same property in Glassnode’s framework: the public key, or a public-key equivalent, is visible by default on-chain. That means these coins are targetable while they remain unspent. The 1-D chart shows BTC trading at $77,600 at the time of writing. Source: BTCUSDT on TradingView.com Operational exposure is where the situation becomes more complex, and where the report places most of its emphasis. In these cases, the outputs are not necessarily vulnerable by design. Instead, they become exposed because the public key has already been revealed at some point during spending, yet Bitcoin remains associated with the same key or script arrangement. Glassnode describes this as an “address reuse problem.” 4 Million Bitcoin Operationally Unsafe Glassnode classifies 4.12 million Bitcoin, or 20.6% of issued supply, as operationally unsafe, and within that bucket, it highlights exchanges as a major labeled subset. Related Reading: National Trust Charters For Crypto Under Fire—Senator Warren Says It Goes Beyond The Law For exchange-related balances , the study estimates 1.66 million BTC, or 8.3% of total supply, falls into the operationally unsafe category. Glassnode notes that this represents approximately 40% of all operationally unsafe BTC. “Operationally unsafe” coins. Source: Glassnode Among the largest exchanges, Glassnode reports that Coinbase labeled balances appear largely concentrated in non-exposed structures, with only 5% exposed balance. By contrast, Binance and Bitfinex show dramatically higher susceptible balances—85% and 100%, respectively. For the countries covered in the report—the United States, the United Kingdom, and El Salvador—Glassnode indicates 0% quantum exposure to their Bitcoin holdings. Featured image created with OpenArt, chart from TradingView.com Editorial Process for bitcoinist is centered on delivering thoroughly researched, accurate, and unbiased content. We uphold strict sourcing standards, and each page undergoes diligent review by our team of top technology experts and seasoned editors. This process ensures the integrity, relevance, and value of our content for our readers. Share Tweet Share Share Sign Up for Our Newsletter! For updates and exclusive offers enter your email. Sign Up I consent to my submitted data being collected and stored. Leave this field empty if you're human: Ronaldo Marquez Follow Ronaldo is a seasoned crypto enthusiast with over four years of experience in the field. He is passionate about exploring the vast and dynamic world of decentralized finance (DeFi) and its practical applications for achieving economic sovereignty. Ronaldo is constantly seeking to expand his knowledge and expertise in the DeFi space, as he believes it holds tremendous potential for transforming the traditional financial landscape. Full Profile Related Posts Bitcoin Rally May Have Been A Trap – Here’s What Demand Data Reveals 1 hour ago The Bitcoin Playbook To Know: Step 4 Says A Crash Is Coming, But Where’s The Bottom? 8 hours ago Bitcoin Seeing A Crucial Shift In Demand Dynamics While Price Action Weakens 11 hours ago Bitcoin Developer Who Worked With Satoshi Just Released A Tool That Changes Online Privacy Forever 19 hours ago Trump Media’s Truth Social Withdraws Bitcoin ETF Filing 23 hours ago Bitcoin Supply In Profit Jumps To 63%: Why Analysts Are Still Cautious 1 day ago Premium Sponsors Press Releases Wadoozie Pays You for Puzzles and Content – Here’s... 24 hours ago Bitcoin Poker Site CoinPoker Joins Triton Montenegro 2026... 2 days ago Best Crypto to Buy Before Exchange Listings? Divine Ray... 5 days ago Binance Moves Toward Autonomous Crypto Trading with Launch... 6 days ago 알트코인 모멘텀 부활… 20% 급등한... 1 week ago Bitcoin news portal providing breaking news, guides, price analysis about decentralized digital money & blockchain technology. Bitcoin News Price Businesses Acceptance Technology Investment Regulation Reviews Altcoins News Price Ethereum Ripple Litecoin EOS Categories Blockchain Security FinTech Technology Trending Breaking News Press Releases How to About Us Advertise Contact us Editorial Policy Privacy Policy © 2026 Bitcoinist.com . All Rights Reserved. Bitcoin News Price Businesses Acceptance Technology Investment Regulation Reviews All Bitcoin News Altcoins News Price Ethereum Ripple Litecoin EOS NAGA All Altcoin News Tech Blockchain Security FinTech Price Bitcoin Price Ethereum Price Binance Coin Price Litecoin Price Industry Industry News Press Releases How to Buy gift cards/mobile Top Ups with Cryptos What Is Bitcoin? Best Bitcoin Wallet Bitcoin vs Ethereum Why Use Blockchain Technology? Bitcoin Cash ABC vs. Bitcoin Cash SV How to Buy Cryptocurrency How to do Crypto Gambling Crypto Casinos Crypto Betting Play Crypto Games Crypto Poker Crypto Slots Crypto Blackjack Crypto Crash Gambling Plinko Bitcoin Mining Best Bitcoin Brokers Best Bitcoin Forex Brokers How To Earn Bitcoin What is Facebook Libra? Ripple and XRP: The Complete Guide Events Play Games Advertise © 2025 Bitcoinist . All Rights Reserved. This website uses cookies. By continuing to use this website you are giving consent to cookies being used. Visit our Privacy Center or Cookie Policy . I Agree",news:bitcoinist,BNB,BNBUSDT,BNBUSDT,hack_security,exploit_or_theft,news:bitcoinist,risk,4
cand_00197,2026-05-21 15:30:06 UTC+8,2026-05-21T07:30:06Z,2026-05-21 15:30:06 UTC+8,Syndicate Labs Shuts Down After Ethereum Rollup Market Shift,"Syndicate Labs Shuts Down After Ethereum Rollup Market Shift Ecosystem English News Markets Features Learn Sponsored About LINK $9.73 1.56% TRX $0.3595 0.74% BCH $377.74 2.10% DOGE $0.1061 2.43% ZEC $667.99 12.80% ETH $2,144 0.70% BNB $655.44 1.80% SOL $87.02 2.55% HYPE $58.52 16.96% XMR $402.58 1.27% XRP $1.38 1.00% ADA $0.2498 0.22% BTC $78,052 0.99% Written by Martin Young ⁠, Staff Writer. Reviewed by Felix Ng ⁠, Staff Editor. Written by Martin Young ⁠, Staff Writer. Reviewed by Felix Ng ⁠, Staff Editor. Syndicate Labs winds down after 5 years, citing shrinking rollup market Latest News Published May 21, 2026 The Ethereum rollup market is dominated by Arbitrum and Base, which have a combined 68% market share, according to L2Beat. Syndicate Labs announced it is winding down after five years of developing onchain infrastructure for customizable Ethereum rollups and sequencers, citing a shrinking market for rollups. The company said on Thursday on X that the decision was necessary because “the rollup market has fundamentally shifted.” “Unfortunately, the rollup market has shrunk dramatically. For every new rollup spinning up, several more are quietly shutting down,” it said. Syndicate Labs is a venture capital-backed company that focuses on enabling customizable, programmable Ethereum appchains, or application-specific rollups, with smart sequencers. It raised $20 million in Series A funding led by Andreessen Horowitz in 2021. The Ethereum scaling ecosystem is dominated primarily by three players — Arbitrum One, Base and OP Mainnet — which command a 75% market share. Smaller players are slowly getting squeezed out as activity and capital concentrate among the top three. Additionally, the total value secured across the layer-2 rollup ecosystem has declined by about 36% since its peak of just over $50 billion in October, with smaller networks losing much more as capital migrated to the industry leaders, according to L2Beat. “L2 activity has dropped 61% since June, leaving many smaller networks as ‘zombie chains’ with minimal usage,” reported 21Shares in December. Three players account for nearly $30 billion in rollup total value secured. Source: L2Beat Rollup market has shifted Syndicate said the market has shifted away from its technology, “making it impossible to wait out these market conditions.” “Instead, custom chains are being built by consulting teams from scratch, with very little reusable tech or network value.” Related: Legend becomes latest DeFi app to throw in towel The company said the Syndicate Network Collective is independent of Syndicate Labs, so SYND token governance is not immediately affected. It also said the decision to wind down was not influenced by the recent bridge compromise. The Syndicate Commons Bridge on Base was exploited in late April because of a security breach and a leaked private key, resulting in the loss of 18.5 million SYND tokens worth about $330,000 at the time. SYND fell 44% after the hack and declined another 21% over the past three hours, hitting an all-time low of $0.012 after the closure announcement, according to CoinGecko. The token is down 99.5% from its September 2025 peak of $2.61. A year of DeFi and crypto closures Syndicate Labs is the latest addition to a growing list of crypto and DeFi closures this year. DeFi mobile superapp Legend announced it was winding down on May 13, citing growth and scaling problems. Other recent closures include Solana DeFi aggregator Step Finance , DeFi derivatives protocol Polynomial, Balancer Labs , the team behind the DeFi protocol Balancer, and Seamless Protocol, a DeFi lending protocol on Base. Magazine: 5 tech predictions the mainstream media got horribly wrong Cointelegraph is committed to independent, transparent journalism. This news article is produced in accordance with Cointelegraph’s Editorial Policy and aims to provide accurate and timely information. Readers are encouraged to verify information independently. Layer2 zk-Rollup Arbitrum Base Ethereum More on the subject Ethereum traders warn of a ‘nasty’ ETH price drop if $2K support breaks 18 hours ago Nancy Lubale Ether taker volume turns negative for first time in two months: Will ETH fall under $2K next? May 19, 2026 Biraajmaan Tamuly South Korean funeral company records $33M unrealized loss on leveraged ETH ETFs May 19, 2026 Zoltan Vardai Ethereum traders warn of a ‘nasty’ ETH price drop if $2K support breaks 18 hours ago Nancy Lubale Ether taker volume turns negative for first time in two months: Will ETH fall under $2K next? May 19, 2026 Biraajmaan Tamuly South Korean funeral company records $33M unrealized loss on leveraged ETH ETFs May 19, 2026 Zoltan Vardai News Latest News Markets Bitcoin Ethereum Altcoins Blockchain Regulation Sponsored Sponsored Articles Press Releases Research Ecosystem Magazine Accelerator Events Decentralization Guardians LONGITUDE Event About About Cointelegraph Editorial Policy Ads Disclosure Financial Risk Disclaimer Cointelegraph is committed to providing independent, high-quality journalism across the crypto, blockchain, AI, and fintech industries. All news, reviews, and analyses are produced with full journalistic independence and integrity. For more details on our standards and processes, please read our Editorial Policy . © Cointelegraph 2013 - 2026 Terms of Service and Privacy Policy",news:cointelegraph,ADA,ADAUSDT,ADAUSDT,hack_security,exploit_or_theft,news:cointelegraph,risk,4
cand_00188,2026-05-21 15:34:52 UTC+8,2026-05-21T07:34:52Z,2026-05-21 15:34:52 UTC+8,Digital Assets Like Ordinals Used in Tax Evasion Schemes: Chainalysis,"Digital Assets Like Ordinals Used in Tax Evasion Schemes: Chainalysis Ecosystem English News Markets Features Learn Sponsored About LINK $9.73 1.56% TRX $0.3595 0.74% BCH $377.74 2.10% DOGE $0.1061 2.42% ZEC $667.92 12.79% ETH $2,144 0.71% BNB $655.39 1.80% SOL $87.01 2.55% HYPE $58.51 16.94% XMR $402.58 1.27% XRP $1.38 0.99% ADA $0.2498 0.23% BTC $78,046 0.98% Written by Stephen Katte ⁠, Staff Writer. Reviewed by Felix Ng ⁠, Staff Editor. Written by Stephen Katte ⁠, Staff Writer. Reviewed by Felix Ng ⁠, Staff Editor. Tax evaders are trying ‘novel digital assets’ to dodge authorities: Chainalysis Latest News Published May 21, 2026 Italian authorities uncovered a tax evasion scheme in which an individual allegedly used Bitcoin Ordinals and the BRC-20 token standard to generate and conceal $1.1 million. Tax dodgers have started turning to Bitcoin Ordinals, BRC-20 tokens and other digital methods in an attempt to hide their wealth from tax authorities, according to blockchain analytics platform Chainalysis. “Tax evasion and unreported income are age-old financial crimes, but the methods used to commit them are rapidly evolving,” Chainalysis said in a report Wednesday. “As digital assets become more mainstream, bad actors frequently attempt to exploit novel technologies — such as NFTs, decentralized finance protocols, or emerging token standards — in hopes of keeping their wealth hidden from tax authorities and law enforcement.” Tax authorities have been scrambling to catch up with technological advances and to track and apply taxes. A March study estimated that only 32% to 56% of US crypto owners report their gains. In Norway, that percentage was only 12%, according to a study from August 2024. Source: Chainalysis Italian authorities uncover $1 million tax evasion scheme Chainalysis reported that Italy’s Economic and Financial Police Unit in Foggia reportedly uncovered a tax evasion scheme in which an individual allegedly used Bitcoin Ordinals and the BRC-20 token standard to hide 1 million euros ($1.1 million) in undeclared capital gains. Introduced in 2023, the Ordinals protocol assigns a serial number to a satoshi, the smallest unit of Bitcoin, and allows data, such as images or text, to be embedded in a Bitcoin transaction. The BRC-20 standard, built on top of it, allows text inscriptions to be deployed, minted into tokens and transferred on the Bitcoin blockchain. Italian authorities discovered during their investigation that the suspect was using the Ordinals protocol and the BRC-20 standard to create tokens, then sent them and listed them on marketplaces, according to Chainalysis. “The assets were sold for multiples of their original cost, and the profits were routed back to the suspect’s primary wallet in Bitcoin,” Chainalysis said. “The suspect continually reinvested these earnings into new inscriptions.” Blockchain intelligence essential infrastructure The US Internal Revenue Service estimates that the gross tax gap, the government’s best estimate of the total tax it is legally owed but did not receive, is about $606 billion. Tax evasion tactics usually include paying in cash and underreporting income. However, Chainalysis said using crypto for tax evasion comes with a “fatal flaw” because of the “inherent transparency of the blockchain. No matter how sophisticated a scheme appears, the underlying technology leaves a permanent immutable trail.” Blockchain intelligence can reconstruct a financial network and cross-reference it with data that crypto exchanges are required to report to unmask transactions tied to suspected tax dodgers, according to Chainalysis. Related: Italy’s largest bank more than doubles crypto holdings to $235M in Q1: Report “This landmark Italian case serves as a powerful reminder for law enforcement and compliance professionals globally: the technical novelty of crypto does not equal anonymity,” it said. “As new digital asset classes continue to emerge and generate income streams, the gap between actual on-chain wealth and declared tax positions will become a primary target for global investigative attention. In today’s financial landscape, blockchain intelligence is essential infrastructure.” Magazine: Bitcoin ETFs bleed $1B, Aave’s $71M ETH unfreeze bid delayed: Hodler’s Digest, May 10 – 16 Cointelegraph is committed to independent, transparent journalism. This news article is produced in accordance with Cointelegraph’s Editorial Policy and aims to provide accurate and timely information. Readers are encouraged to verify information independently. Taxes Cryptocurrencies Law Industry More on the subject Hyperliquid ETFs surprise with 50% volume jump after slow launch 4 hours ago Jesse Coghlan Coinbase expands branded stablecoin infrastructure business with Flipcash USDF launch 11 hours ago Nate Kostar Tether buys SoftBank’s stake in Bitcoin company Twenty One Capital 15 hours ago Sam Bourgi Hyperliquid ETFs surprise with 50% volume jump after slow launch 4 hours ago Jesse Coghlan Coinbase expands branded stablecoin infrastructure business with Flipcash USDF launch 11 hours ago Nate Kostar Tether buys SoftBank’s stake in Bitcoin company Twenty One Capital 15 hours ago Sam Bourgi News Latest News Markets Bitcoin Ethereum Altcoins Blockchain Regulation Sponsored Sponsored Articles Press Releases Research Ecosystem Magazine Accelerator Events Decentralization Guardians LONGITUDE Event About About Cointelegraph Editorial Policy Ads Disclosure Financial Risk Disclaimer Cointelegraph is committed to providing independent, high-quality journalism across the crypto, blockchain, AI, and fintech industries. All news, reviews, and analyses are produced with full journalistic independence and integrity. For more details on our standards and processes, please read our Editorial Policy . © Cointelegraph 2013 - 2026 Terms of Service and Privacy Policy",news:cointelegraph,AAVE,AAVEUSDT,AAVEUSDT,hack_security,exploit_or_theft,news:cointelegraph,risk,4
