candidate_id,raw_id,published_at,published_at_utc,published_at_china,backtest_time,backtest_time_utc,backtest_time_china,source_timezone,source_timezone_assumption,title,content,source,url,primary_asset_symbol,primary_entity,primary_entity_type,detected_entity_names,event_type_l1,event_type_l2,event_scope,publish_decision,research_priority,relevance_score_realtime,impact_score,certainty_score,timeliness_score,entity_quality_score,source_count,duplicate_count,discard_reason,primary_discard_reason,secondary_discard_reasons,tradability_tier,tradability_tier_reason,channel_route,entity_flags,quality_flags,recommended_benchmark,benchmark_reason,manual_decision,manual_event_type_l1,manual_event_type_l2,manual_primary_asset_symbol,manual_notes
cand_00388,news:1023:ef688f76e73df0b7,2026-05-19 02:13:48 UTC+8,2026-05-18T18:13:48Z,2026-05-19 02:13:48 UTC+8,2026-05-19 02:13:48 UTC+8,2026-05-18T18:13:48Z,2026-05-19 02:13:48 UTC+8,UTC,source_rule:news:cryptonews,"Leading AI day trading bots in 2026: Why most fail, and what actually works","Disclosure: This article does not represent investment advice. The content and materials featured on this page are for educational purposes only.

AI crypto trading bots surge in demand as traders struggle with volatility and unreliable automation tools.

The global AI trading platform market surpassed $11 billion in 2024 and is on track toward $33 billion by 2030. Demand is surging — and so is disappointment.

Thousands of traders in 2026 are searching for a Claude AI trading bot , a quick ChatGPT-powered script, or a generic AI day trading bot they can deploy overnight. Most fail to profit. Many lose money. The reasons are consistent: untested strategies, zero built-in risk controls, and no live market optimization.

In 2026, crypto markets move faster than ever. Bitcoin volatility remains elevated, memecoin rotations happen within hours, and macro events shift liquidity across the entire digital asset market in minutes. Reacting manually — or relying on an improvised LLM-based script — is no longer viable.

This guide ranks the best platforms for automated AI crypto day trading , with an honest look at what separates winners from the rest.

Best for: Beginners, passive investors, and anyone who wants a no-code AI crypto trading bot with real risk management

SaintQuant is the clearest answer for traders who want automated AI day trading without technical setup or coding knowledge. While other platforms require strategy configuration, API wiring, and ongoing maintenance, SaintQuant provides pre-optimized quantitative strategies that are live and running from day one.

What makes SaintQuant stand out in 2026:

Best for: Anyone searching for a reliable no-code AI crypto trading platform that handles execution, risk, and strategy automatically.

Limitation: Crypto-only (not stocks or forex); pre-built strategies are not manually customizable.

Verdict: SaintQuant is the most complete answer to what most traders actually want from an AI day trading bot in 2026 — hands-free execution with real risk controls, zero setup, and a risk-free way to start.

Best for: Active traders who want multi-exchange control and custom strategy workflows

3Commas remains one of the most recognized names in crypto automation in 2026. It supports DCA bots, grid bots, and SmartTrade workflows across multiple exchanges. Its AI assistant surfaces model-driven suggestions for entries, risk settings, and targets — but users must review and act on these themselves.

Best for: Experienced traders who want hands-on control. Not ideal for beginners — results depend heavily on the user’s own strategy quality, and misconfigured bots are a common cause of losses.

Verdict: Powerful for active traders. Too complex and high-maintenance for those seeking a passive AI trading bot experience.

Best for: Cost-conscious beginners wanting built-in bots on a single exchange

Pionex integrates trading bots directly into its exchange, eliminating the need for external API connections. Its PionexGPT feature allows plain-English strategy creation for basic automation. No subscription fees — only standard trading fees apply.

Best for: Casual crypto traders who want low-cost automated crypto trading with minimal overhead. Falls short as a true AI-driven risk management solution in volatile 2026 market conditions.

Verdict: A solid starting point for experimentation, but not a substitute for a platform with genuine quantitative strategy depth.

Best for: Traders who want a strategy marketplace and copy trading

Cryptohopper combines a visual Strategy Designer, a curated Marketplace of community strategies, and Social/copy trading in a cloud environment. Its Algorithm Intelligence feature can switch strategies automatically based on conditions.

Best for: Traders who want AI-assisted crypto automation with community strategy access. The open marketplace means strategy quality is uneven — beginners may struggle to identify what works.

Verdict: More flexible than most, but the burden of selecting good strategies still falls on the user.

Best for: Developers exploring experimental prototypes (not live trading)

In 2026, many traders still attempted to build a Claude AI trading bot or GPT-powered script from scratch using language model APIs. The appeal is obvious — but the execution is consistently problematic.

LLMs are not designed for real-time financial execution. They lack:

The result is typically an unreliable bot that generates inconsistent signals, requires constant debugging, and operates with no circuit breakers during drawdowns. Several 2026 trading communities have documented significant capital losses from poorly implemented DIY bots.

Best for: Technical experimentation only. Never recommended for live capital deployment without a full quantitative infrastructure built around the LLM layer.

Verdict: An interesting engineering exercise — not a viable AI day trading bot for consistent returns. Use purpose-built platforms like SaintQuant instead.

The strongest AI crypto trading platforms in 2026 share three qualities: they simplify strategy setup, include adaptive risk management, and operate continuously without requiring user intervention. Here is a quick decision framework:

SaintQuant’s AI quantitative strategies are live and ready. No setup, no coding, no deposit needed to begin.

New user bonuses — automatically credited on registration:

Start Trading Free at SaintQuant — No Deposit Required

Can I use Claude AI as a crypto trading bot? Claude is a conversational AI assistant — it is not built for live automated crypto execution. It lacks real-time exchange integrations and quantitative risk controls. For actual AI-powered day trading , purpose-built platforms like SaintQuant are far more reliable and safer to use with real capital.

What makes an AI day trading bot actually profitable in 2026? Profitability in 2026 depends on two things most bots still lack: battle-tested quantitative strategies and adaptive risk management. SaintQuant embeds both into every strategy, so users are not exposed to unchecked drawdowns during volatile markets.

Is SaintQuant free to try? Yes. New users receive a $99 free trial credit to run live strategies, plus a $7 cash bonus on registration — with no deposit required and no hidden terms.

Do I need coding skills or trading experience to use SaintQuant? None at all. SaintQuant is designed specifically for users who want automated crypto trading without any technical background. Strategies are pre-configured and start with a few clicks.

How is SaintQuant different from other AI trading bots in 2026? Most platforms require users to configure strategies, monitor performance, and manage risk manually. SaintQuant handles all of this automatically — including built-in risk controls — making it the closest thing to a fully managed AI crypto trading solution available to retail investors.

Disclosure: This content is provided by a third party. Neither crypto.news nor the author of this article endorses any product mentioned on this page. Users should conduct their own research before taking any action related to the company.",news:cryptonews,https://crypto.news/leading-ai-day-trading-bots-in-2026-why-most-fail-and-what-actually-works/,BTC,asset_btc,asset,Bitcoin|Strategy|AI,institutional_flow,etf_or_fund_flow,market_wide,discard,discard,66.75,70,85.0,80,85,1,1,"duplicate_non_primary,scraped_footer_noise",scraped_footer_noise,duplicate_non_primary,T2,market_wide_or_policy_event,macro_policy,scraped_footer_noise,market_wide_event,market_wide_separate,market_wide_events_need_separate_evaluation,,,,,
cand_00466,news:1029:34ee2fa6ee4f5729,2026-05-19 01:04:05 UTC+8,2026-05-18T17:04:05Z,2026-05-19 01:04:05 UTC+8,2026-05-19 01:04:05 UTC+8,2026-05-18T17:04:05Z,2026-05-19 01:04:05 UTC+8,Asia/Shanghai,default_china,"'XRP Is the World Bridge Currency,' Says LIFTT Capital's Ted","Writer by choice, CryptoCurrency Writer, and Researcher by chance. Currently, focusing on financial news and analysis, as well as cryptocurrency news and data. One may not call me a crypto “Enthusiast” but trust me I'm getting there.

Writer by choice, CryptoCurrency Writer, and Researcher by chance. Currently, focusing on financial news and analysis, as well as cryptocurrency news and data. One may not call me a crypto “Enthusiast” but trust me I'm getting there.

Writer by choice, CryptoCurrency Writer, and Researcher by chance. Currently, focusing on financial news and analysis, as well as cryptocurrency news and data. One may not call me a crypto “Enthusiast” but trust me I'm getting there.

At Hederacon, an official side event to Consensus 2026 in Miami, Ted from LIFTT Capital was asked one question about XRP and his answer was three words. ‘World Bridge Currency,’ he said.

Ted’s explanation starts with a simple observation about where the financial world currently sits. PayPal, Cash App, and every major payment platform operate as closed loops. Money goes in, money stays inside. Moving value between these walled gardens is slow, expensive, and dependent on intermediaries that add friction at every step.

The solution he described is interoperability, the ability for these closed systems to connect and exchange value seamlessly. And in his view, the bridge currency that enables that connection is XRP.

“I am not talking about a coin. I am not talking about a dollar. I am not talking about an exchange note,” Ted said. “Currency is the purest form of money and that is what we are going to be seeing with XRP.”

One of the most common debates inside the XRP community is whether RLUSD, Ripple’s dollar-backed stablecoin, competes with or complements XRP. Ted was direct about where he stands.

For XRP to function as a global bridge currency at scale, it needs a stable layer that provides liquidity without price volatility during settlement. RLUSD provides that stability. XRP provides the bridge. The two are designed to work together rather than compete.

He pointed to Brad Garlinghouse and Monica Long having publicly stated that Ripple is actively arranging for XRP to serve as the world bridge currency, describing it not as hype but as observable direction.

“Brad Garlinghouse said it on stage at XRP Las Vegas. We are moving toward a multi-chain world,” Ted said. “That is not tribalism. That is where the technology is actually going.”",news:coinpedia,https://coinpedia.org/news/xrp-is-the-world-bridge-currency-says-liftt-capitals-ted/,XRP,asset_xrp,asset,XRP,regulation_macro,macro,multi_asset,discard,discard,66.25,55,75.0,80,70,3,3,"unsupported_asset,duplicate_non_primary",unsupported_asset,duplicate_non_primary,T2,market_wide_or_policy_event,macro_policy,candidate_asset_mismatch,"multi_asset,market_wide_event",BTC_ETH_BLEND,token_event_uses_blended_btc_eth,,,,,
cand_00468,news:1029:8249d64b3ad1c846,2026-05-19 01:03:28 UTC+8,2026-05-18T17:03:28Z,2026-05-19 01:03:28 UTC+8,2026-05-19 01:03:28 UTC+8,2026-05-18T17:03:28Z,2026-05-19 01:03:28 UTC+8,Asia/Shanghai,default_china,XRP Co-Creator David Schwartz Donates XRP to John Deaton's Senate Campaign,"Writer by choice, CryptoCurrency Writer, and Researcher by chance. Currently, focusing on financial news and analysis, as well as cryptocurrency news and data. One may not call me a crypto “Enthusiast” but trust me I'm getting there.

Writer by choice, CryptoCurrency Writer, and Researcher by chance. Currently, focusing on financial news and analysis, as well as cryptocurrency news and data. One may not call me a crypto “Enthusiast” but trust me I'm getting there.

Writer by choice, CryptoCurrency Writer, and Researcher by chance. Currently, focusing on financial news and analysis, as well as cryptocurrency news and data. One may not call me a crypto “Enthusiast” but trust me I'm getting there.

Ripple’s Chief Technology Officer David Schwartz, known online as JoelKatz, has sent an undisclosed amount of XRP to support attorney John Deaton’s US Senate campaign. The move quickly gained attention across the XRP community, not just because of who made the donation but because of the history between the two men.

Schwartz is one of the three original architects of the XRP Ledger. Deaton is the lawyer who led 75,000 XRP holders in an independent legal fight against the SEC that helped produce one of the most significant rulings in crypto legal history.

Deaton did not take the gesture lightly. In a post on X he described Schwartz as a “legit genius” and laid out exactly why the contribution meant something beyond a standard campaign donation.

He reminded his followers that before building the XRP Ledger, Schwartz worked as a contractor for the NSA developing encrypted cloud storage and enterprise messaging systems. He then contributed to Bitcoin’s codebase in 2011 before joining forces with Jed McCaleb and the famously private Arthur Britto to co-create the XRP Ledger from scratch.

The ledger they built in 2011 and launched in 2012 settles payments in three seconds, handles 1,500 transactions per second, and contained the world’s very first decentralised exchange built directly into its protocol. Deaton called it a technology that helped lead the crypto revolution alongside Bitcoin and Ethereum.

“Three legends. One ledger. And it is an honor for one of them to help me try and bring commonsense-based, nonpartisan leadership to the US Senate,” Deaton wrote.

The significance of Schwartz supporting Deaton goes beyond mutual respect between crypto figures. The two are connected by one of the most consequential legal battles the cryptocurrency industry has ever seen.

Deaton and 75,000 XRP holders took on the SEC completely independently of Ripple’s own legal defence. He submitted amicus briefs, made oral arguments in the LBRY case that were later cited by the judge in the Ripple ruling, and submitted 4,000 XRP holder affidavits directly into the case record.

When Judge Analisa Torres ruled that XRP in and of itself is not a security, she cited Deaton’s work directly in her opinion. The ruling that now forms the legal backbone of the CLARITY Act’s treatment of XRP was shaped in part by a lawyer who is now running for Senate.",news:coinpedia,https://coinpedia.org/news/xrp-co-creator-david-schwartz-donates-xrp-to-john-deatons-senate-campaign/,XRP,asset_xrp,asset,XRP|SEC,regulation_macro,regulation,multi_asset,discard,discard,66.25,55,75.0,80,70,3,3,duplicate_non_primary,duplicate_non_primary,,T2,market_wide_or_policy_event,macro_policy,candidate_asset_mismatch,"multi_asset,unknown_event_type",BTC_ETH_BLEND,token_event_uses_blended_btc_eth,,,,,
cand_00403,news:1023:28dfd4c9fd873384,2026-05-19 01:59:40 UTC+8,2026-05-18T17:59:40Z,2026-05-19 01:59:40 UTC+8,2026-05-19 01:59:40 UTC+8,2026-05-18T17:59:40Z,2026-05-19 01:59:40 UTC+8,UTC,source_rule:news:cryptonews,Lotment Capital announces a new standard in client success,"Disclosure: This article does not represent investment advice. The content and materials featured on this page are for educational purposes only.

Lotment Capital expands multi-asset strategy access, including crypto investment tools for users.

Lotment Capital is committed to supporting users every step of the way, offering a wide range of tools and solutions that help them focus on decision-making and the implementation of their ideas. The company has created a system that combines a diverse range of assets, a functional platform, and the professional support of its team. This empowers clients to optimise their time and make data-driven decisions.

One of Lotment Capital advantages is access to a wide range of financial instruments. The company offers customers the opportunity to work with assets across various categories, including cryptocurrencies, paving the way for the creation of flexible and promising portfolios. This diversity allows investors to evaluate the strengths of each segment, combining tools with different characteristics and growth potential.

Working with multiple areas allows clients to develop a strategy that aligns with their personal goals and trading style. Some choose assets with stable dynamics, others prefer more innovative instruments or combine both approaches. Lotment Capital creates an environment where every investor can find a suitable option and effectively exploit its opportunities.

Furthermore, access to cryptocurrencies opens up additional opportunities, as this segment continues to grow rapidly. The ability to include digital assets in a portfolio makes working with the company particularly attractive for those seeking to make a profit on current market trends and unique conditions.

A functional platform is the foundation of a successful investor, and Lotment Capital places special emphasis on this area. The company provides clients with access to a wide range of tools that help them analyse the market, manage trades, and build strategies based on current information.

The platform includes analytical solutions that allow the customer to track asset dynamics, identify patterns, and find new entry points. Thanks to its user-friendly interface, investors can quickly navigate data and make decisions based on objective information.

Additional trade management tools help clients effectively control customers’ positions. The ability to flexibly adjust parameters and quickly respond to market makes working more convenient and productive. The Lotment Capital platform is designed to ensure that every user can work in a comfortable environment and utilise all available features to their full potential.

Another key advantage of Lotment Capital is the ability to receive assistance from a team of experienced specialists. Clients can contact the company’s professionals for advice on specific situations or to create a comprehensive strategy tailored to their goals.

This support is especially valuable for those seeking to develop and improve their skills. Specialists help analyse the market, identify promising areas, and make decisions based on objective data. This allows clients to feel confident and move forward with a clear understanding of their steps.

Furthermore, the ability to receive individualised recommendations makes working with Lotment Capital more personalised. Each investor receives attention and support that helps them achieve their goals and maximise the market’s potential.

By combining a wide selection of assets, a functional platform, and professional support, Lotment Capital creates an atmosphere in which clients can confidently grow and achieve impressive results on an ongoing basis. The company strives to provide users with all the necessary tools and opportunities to help every investor realise their potential and build a successful strategy. This approach allows them to enjoy a comfortable trading environment.

The company’s format of interaction creates a solid foundation for long-term cooperation. This makes it a partner for those striving for success and looking to confidently move forward in the world of investing.

Disclosure: This content is provided by a third party. Neither crypto.news nor the author of this article endorses any product mentioned on this page. Users should conduct their own research before taking any action related to the company.",news:cryptonews,https://crypto.news/lotment-capital-announces-a-new-standard-in-client-success/,,org_strategy,org,Strategy|Hacker,hack_security,exploit_or_theft,market_wide,discard,discard,66.25,80,75.0,80,75,1,0,scraped_footer_noise,scraped_footer_noise,,T1,direct_asset_event_with_price,alpha_candidate,scraped_footer_noise,market_wide_event,market_wide_separate,market_wide_events_need_separate_evaluation,,,,,
cand_00372,2056442276390301714,2026-05-19 02:30:20 UTC+8,2026-05-18T18:30:20Z,2026-05-19 02:30:20 UTC+8,2026-05-19 02:30:20 UTC+8,2026-05-18T18:30:20Z,2026-05-19 02:30:20 UTC+8,Asia/Shanghai,source_rule:webhook,"🚨 NEW: Cloudflare says Anthropic’s Mythos found bugs, but AI-written patches can quietly break other code.

Says AI secu","🚨 NEW: Cloudflare says Anthropic’s Mythos found bugs, but AI-written patches can quietly break other code.

Says AI security needs stronger architecture, not just faster scanning and patching. https://t.co/kGn2tz6lwt",webhook,,,entity_ai,sector,AI,regulation_macro,regulation,unknown,discard,discard,65.5,65,80.0,80,60,2,1,"duplicate_non_primary,low_crypto_relevance",low_crypto_relevance,duplicate_non_primary,T2,market_wide_or_policy_event,macro_policy,,"missing_asset,unknown_event_type",,missing_asset_no_benchmark,,,,,
cand_00002,2056565573220245928,2026-05-19 10:40:16 UTC+8,2026-05-19T02:40:16Z,2026-05-19 10:40:16 UTC+8,2026-05-19 10:40:16 UTC+8,2026-05-19T02:40:16Z,2026-05-19 10:40:16 UTC+8,Asia/Shanghai,source_rule:webhook,美联储新主席即将宣誓就职，谷歌与黑石合作推出AI云公司,币界网消息，据Cointelegraph报道，今日新闻摘要包括：凯文·沃什将于周五宣誓就任新任美联储主席，接替杰罗姆·鲍威尔。谷歌与黑石联合推出AI云公司，黑石承诺提供50亿美元股权支持。Bitwise宣布将持有$HYPE代币，分配其HyperLiquid ETF（BHYP）管理费的10%用于该代币。Meta计划裁减20%员工，7000名员工转向AI项目，重组定于5月20日。美国证券交易委员会（SEC）取消“禁言令”，允许公司在达成和解后不再保持沉默。埃隆·马斯克将向第九巡回法院上诉，因法院驳回对OpenAI的诉讼。预计美国CPI通胀率将上升至5%以上，可能为2023年2月以来最高水平。一位美国官员称，伊朗最新和平提案“不足”，提高了冲突风险。明尼苏达州州长签署法案，允许银行和信用合作社。,webhook,,HYPE,asset_hype,asset,Hyperliquid|SEC|Federal Reserve|CPI|US Dollar|ETF|AI|Bitwise,regulation_macro,macro,market_wide,discard,discard,65.25,65,85.0,80,85,1,0,ai_only_non_crypto,ai_only_non_crypto,,T2,market_wide_or_policy_event,macro_policy,ai_only_non_crypto,market_wide_event,market_wide_separate,market_wide_events_need_separate_evaluation,,,,,
cand_00045,news:1033:d2eb0de3376dd8f1,2026-05-19 09:21:43 UTC+8,2026-05-19T01:21:43Z,2026-05-19 09:21:43 UTC+8,2026-05-19 09:21:43 UTC+8,2026-05-19T01:21:43Z,2026-05-19 09:21:43 UTC+8,Asia/Shanghai,source_rule:news:jin10,美联储在固定利率逆回购操作中总计接纳了21个对手方的71.93亿美元,美联储在固定利率逆回购操作中总计接纳了21个对手方的71.93亿美元。,news:jin10,https://www.jin10.com/detail/20260519012143539800.html,,org_fed,macro,Federal Reserve|Interest Rate|US Dollar,regulation_macro,macro,market_wide,discard,discard,64.5,65,70.0,80,75,2,4,"duplicate_non_primary,low_crypto_relevance",low_crypto_relevance,duplicate_non_primary,T2,market_wide_or_policy_event,macro_policy,,market_wide_event,market_wide_separate,market_wide_events_need_separate_evaluation,,,,,
cand_00066,news:1033:d342387b4fa073bd,2026-05-19 08:57:43 UTC+8,2026-05-19T00:57:43Z,2026-05-19 08:57:43 UTC+8,2026-05-19 08:57:43 UTC+8,2026-05-19T00:57:43Z,2026-05-19 08:57:43 UTC+8,Asia/Shanghai,source_rule:news:jin10,沃什周五将宣誓就任美联储主席 宣誓仪式由特朗普主持,据福克斯商业频道周一援引白宫官员的话报道称，沃什将于周五在白宫举行的仪式上宣誓就任美联储主席，仪式将由特朗普主持。美国参议院周三批准沃什出任美联储主席，这位56岁的律师兼金融家将执掌美国央行。当前美联储正面临日益加剧的通胀压力 ，这可能使特朗普所要求的降息举措难以推行。作为特朗普提名的美联储主席人选，沃什的上任有望为特朗普政府与美联储的关系带来新开端。此前八年间，白宫与美联储之间摩擦不断，又经历了全球疫情和与高通胀的斗争。沃什将从鲍威尔手中接过领导权。,news:jin10,https://www.jin10.com/detail/20260519005743395800.html,,org_fed,macro,Federal Reserve|CPI|Interest Rate,regulation_macro,macro,market_wide,discard,discard,64.5,65,70.0,80,75,2,4,low_crypto_relevance,low_crypto_relevance,,T2,market_wide_or_policy_event,macro_policy,,market_wide_event,market_wide_separate,market_wide_events_need_separate_evaluation,,,,,
