candidate_id,raw_id,raw_published_at,published_at,published_at_utc,published_at_china,raw_source_published_at,source_published_at_utc,source_published_at_china,source_timezone,source_timezone_assumption,source_lag_minutes,backtest_time,backtest_time_utc,backtest_time_china,backtest_time_basis,time_timezone_assumption,time_parse_status,time_parse_flags,title,content,source,url,candidate_asset_symbol,candidate_binance_spot_symbol,candidate_binance_futures_symbol,candidate_event_type,candidate_direction_hint,candidate_importance,event_scope,asset_confidence,time_confidence,needs_review,review_decision,review_notes,quality_flags,auto_quality_score,suggested_reason,suggested_review_decision,review_priority,parsed_backtest_time_utc,event_age_hours,horizon_status,is_mature_72h,historical_replay_mode
cand_00402,news:1023:1d56eb38585cf2f6,2026-05-18T18:00:00Z,2026-05-19 02:00:00 UTC+8,2026-05-18T18:00:00Z,2026-05-19 02:00:00 UTC+8,,,,UTC,source_rule:news:cryptonews,,2026-05-19 02:00:00 UTC+8,2026-05-18T18:00:00Z,2026-05-19 02:00:00 UTC+8,published_at,Asia/Shanghai_for_naive_time,ok,,NYDIG warns US crypto market-structure bill could 'fail' if August window is missed,"NYDIG says a rare bipartisan window to pass a comprehensive US crypto market‑structure bill could slam shut if Congress fails to move it before the August recess.

Digital asset investment firm NYDIG has warned that the leading US crypto market-structure bill may effectively “fail” if it does not make substantial progress in Congress before lawmakers leave Washington for the August recess, according to FinanceFeeds. The firm argues that the fragile bipartisan consensus around a broad crypto regulatory framework amounts to a “brief window” that could slam shut once Congress returns to a calendar dominated by midterm elections, budget fights and partisan priorities.

NYDIG’s assessment is blunt: if the bill does not advance “in the coming months,” the probability of passage “may significantly decrease” as legislative attention fragments and the political cost of tackling crypto grows. In that scenario, the US risks replaying the past several years of gridlock, with high-profile enforcement actions filling the vacuum left by the absence of a clear statutory market-structure regime.

At stake is one of the most ambitious attempts yet to build a comprehensive federal framework for digital assets in the US. The draft bill is designed to clarify how tokens are classified, draw a bright line between securities overseen by the SEC and commodities under the CFTC, and create unified operational standards for exchanges, brokers and other crypto businesses.

According to the FinanceFeeds report, the proposed market-structure legislation would, for the first time, codify which digital assets fall under securities law and which are treated as commodities, addressing a long-running turf war between the SEC and CFTC. It would also establish common rules for trading venues and service providers, aiming to replace today’s patchwork of guidance, enforcement actions and state-by-state licensing with a single, more predictable regime.

But NYDIG notes that key issues remain unresolved, including stablecoin oversight, how to regulate DeFi protocols , the contours of consumer protection and how to handle conflicts of political interest. Those disagreements have slowed negotiations and raised doubts about whether lawmakers can lock in compromises before the August deadline.

The firm’s warning comes as global competition intensifies. NYDIG points out that extended US uncertainty is already driving capital, talent and innovation toward jurisdictions with clearer rules, citing the UAE , Singapore and the EU’s MiCA framework as examples of regions that are actively benefiting from America’s drift.

If Congress misses this legislative window, industry participants fear the US could again default to rulemaking by enforcement, with no durable settlement on market structure for years. That would leave exchanges, issuers and developers operating under legal ambiguity just as other financial centers lock in their own digital-asset regimes and pitch themselves as safer homes for long-term investment.",news:cryptonews,https://crypto.news/nydig-warns-us-crypto-market-structure-bill-could-fail-if-august-window-is-missed/,BTC,BTCUSDT,BTCUSDT,macro,observe,4,market_wide,medium,high,true,include,,market_wide_event,105,"has_asset,has_binance_symbol,time_ok,typed_event,time_confidence_high,importance_ge_4",include,high,2026-05-18T18:00:00Z,228.1264,mature_72h,true,conservative
cand_00398,news:1033:89a129a93a6a97b2,2026-05-18T18:03:56Z,2026-05-19 02:03:56 UTC+8,2026-05-18T18:03:56Z,2026-05-19 02:03:56 UTC+8,,,,Asia/Shanghai,source_rule:news:jin10,,2026-05-19 02:03:56 UTC+8,2026-05-18T18:03:56Z,2026-05-19 02:03:56 UTC+8,published_at,Asia/Shanghai_for_naive_time,ok,,日本经济再生大臣赤泽亮正：巴西是与我们建立了紧密贸易与投资关系的重要伙伴，同时也是全球第九大产油国,日本经济再生大臣赤泽亮正：巴西是与我们建立了紧密贸易与投资关系的重要伙伴，同时也是全球第九大产油国。我们将进一步深化在原油供应、投资环境改善以及关键矿产保障等方面的合作关系。,news:jin10,https://www.jin10.com/detail/20260518180356147800.html,BTC,BTCUSDT,BTCUSDT,macro,observe,4,market_wide,medium,high,true,include,,market_wide_event,105,"has_asset,has_binance_symbol,time_ok,typed_event,time_confidence_high,importance_ge_4",include,high,2026-05-18T18:03:56Z,228.0608,mature_72h,true,conservative
cand_00396,news:1032:56c9591ae126c79b,2026-05-18T18:05:17Z,2026-05-19 02:05:17 UTC+8,2026-05-18T18:05:17Z,2026-05-19 02:05:17 UTC+8,,,,Asia/Shanghai,default_china,,2026-05-19 02:05:17 UTC+8,2026-05-18T18:05:17Z,2026-05-19 02:05:17 UTC+8,published_at,Asia/Shanghai_for_naive_time,ok,,"Stock Market Today: S&P 500, Dow Jones Slip as Oil Prices and Treasury Yields Rise","US stocks slipped as rising oil prices and Treasury yields pressured tech shares ahead of Nvidia earnings and fresh inflation concerns.

The S&P 500 slipped 0.2% while the Nasdaq Composite dropped 0.7% on Monday, extending losses for a second straight session as rising oil prices and bond yields weighed on investor sentiment. In contrast, the Dow Jones Industrial Average edged up 0.1%, highlighting a growing divergence across major indices.

The pullback comes just days after record highs. So, what changed so quickly? A mix of inflation concerns, geopolitical risks, and sector-specific weakness has started to challenge the market’s momentum.

Oil prices continued to climb, with West Texas Intermediate trading above $107 per barrel and Brent crude near $111 . These gains reflect ongoing tensions in the Middle East and uncertainty around the Strait of Hormuz.

Why does this matter for stocks? Higher oil prices tend to fuel inflation, which in turn keeps interest rates elevated. That combination often pressures equities, especially growth-oriented sectors.

At the same time, global bond yields remain elevated. The U.S. 30-year Treasury yield recently reached its highest level in about a year, while long-term yields in the U.K. and Japan also climbed to multi-decade highs.

This rise in yields has a direct impact on tech stocks. As borrowing costs increase, future earnings become less attractive in present value terms. That dynamic has started to weigh heavily on the Nasdaq.

Technology shares, which drove much of the recent rally, faced renewed selling pressure. The Nasdaq-100 index had already posted its worst daily drop in weeks on Friday, and weakness carried into Monday’s session.

The semiconductor space stood out. Seagate shares fell 7% after its CEO warned that new factory capacity would take longer to come online. That comment raised concerns about whether the industry can keep up with surging demand.

Micron Technology also declined around 2%, reflecting broader worries about supply constraints in the memory chip market. These developments come at a critical time, as investors prepare for Nvidia’s upcoming earnings report.

Could this signal a turning point for the AI-driven rally? Not necessarily—but it does highlight growing sensitivity to execution risks within the sector.

Recent economic data has reinforced concerns about persistent inflation. Both consumer and producer price reports came in hotter than expected, suggesting that price pressures remain entrenched.

This complicates the outlook for monetary policy. Investors now see a lower probability of near-term rate cuts from the Federal Reserve, which removes a key support for equities.

Market participants are asking a simple question: can stocks continue to rally without easing financial conditions? The answer remains uncertain, especially with oil prices adding fresh inflationary pressure.

Tensions between the United States and Iran continue to influence market behavior. Negotiations have stalled, and rhetoric from both sides has intensified, keeping uncertainty high. U.S President Donald Trump threatened consequences for Iran if its leaders did not act quickly, saying “the Clock is Ticking” in a Truth Social post on Sunday.

The Strait of Hormuz remains a focal point. Any disruption to energy flows through this critical route has immediate consequences for global markets.

This backdrop has led some investors to adopt a more cautious stance. Profit-taking has started to emerge after the recent rally, particularly in high-growth sectors.

The near-term outlook hinges on several key factors. Nvidia’s earnings will likely set the tone for the tech sector, while oil prices and bond yields will continue to influence broader sentiment.

At the same time, developments in the Middle East could quickly shift market dynamics. A diplomatic breakthrough could ease pressure, while further escalation would likely have the opposite effect.

Now, markets appear to be entering a more volatile phase. After a strong run to record highs, investors are reassessing risks, and the balance between growth and inflation is once again in focus.

Don’t miss out and join our newsletter to get the latest, well-curated news from the crypto world!

https://coinpaper.com/17113/stock-market-today-s-and-p-500-dow-jones-slip-as-oil-prices-and-treasury-yields-rise",news:coinpaper,https://coinpaper.com/17113/stock-market-today-s-and-p-500-dow-jones-slip-as-oil-prices-and-treasury-yields-rise,BTC,BTCUSDT,BTCUSDT,macro,observe,4,market_wide,medium,high,true,include,,market_wide_event,105,"has_asset,has_binance_symbol,time_ok,typed_event,time_confidence_high,importance_ge_4",include,high,2026-05-18T18:05:17Z,228.0383,mature_72h,true,conservative
cand_00394,news:1033:eaa666a5192bae41,2026-05-18T18:06:46Z,2026-05-19 02:06:46 UTC+8,2026-05-18T18:06:46Z,2026-05-19 02:06:46 UTC+8,,,,Asia/Shanghai,source_rule:news:jin10,,2026-05-19 02:06:46 UTC+8,2026-05-18T18:06:46Z,2026-05-19 02:06:46 UTC+8,published_at,Asia/Shanghai_for_naive_time,ok,,美国和菲律宾正“迅速推进”建设人工智能中心的计划,"一位美国高级官员表示，美国和菲律宾正在“非常迅速地”推进在该东南亚国家建设一个人工智能及供应链中心的计划，且华盛顿方面正寻求为美国投资者提供长期保障。美国国务院负责经济事务的副国务卿雅各布·赫尔伯格表示：“那些打算投入数十亿美元用于大规模基础设施建设的投资者，必须确保这些投资能够经受住两国政府更迭的考验，并且要有一定的持久性和确定性。”赫尔伯格考察了位于马尼拉以北新克拉克市拟建的4,000英亩地块，并带领十多家美国企业一同前往。双方将就如何保障投资者权益以及确保“其方案对菲律宾而言也合情合理”展开详细讨论。上个月，随着菲律宾加入由美国主导的供应链联盟“Pax Silica”，该工业中心的规划随之公布。据悉，克拉克基地将成为“Pax Silica”的首个原生人工智能产业加速中心，旨在支持人工智能、数字基础设施、先进制造和面向未来的技术等新兴产业。",news:jin10,https://www.jin10.com/detail/20260518180646973800.html,BTC,BTCUSDT,BTCUSDT,macro,observe,4,market_wide,medium,high,true,include,,market_wide_event,105,"has_asset,has_binance_symbol,time_ok,typed_event,time_confidence_high,importance_ge_4",include,high,2026-05-18T18:06:46Z,228.0136,mature_72h,true,conservative
cand_00387,news:1033:e9724178ff550b90,2026-05-18T18:14:57Z,2026-05-19 02:14:57 UTC+8,2026-05-18T18:14:57Z,2026-05-19 02:14:57 UTC+8,,,,Asia/Shanghai,source_rule:news:jin10,,2026-05-19 02:14:57 UTC+8,2026-05-18T18:14:57Z,2026-05-19 02:14:57 UTC+8,published_at,Asia/Shanghai_for_naive_time,ok,,据伊朗塔斯尼姆通讯社：来自谈判团队的消息人士透露，伊朗的新方案侧重于就结束战争进行谈判以及由美方建立信任,据伊朗塔斯尼姆通讯社：来自谈判团队的消息人士透露，伊朗的新方案侧重于就结束战争进行谈判以及由美方建立信任。,news:jin10,https://www.jin10.com/detail/20260518181457754800.html,BTC,BTCUSDT,BTCUSDT,macro,observe,4,market_wide,medium,high,true,include,,market_wide_event,105,"has_asset,has_binance_symbol,time_ok,typed_event,time_confidence_high,importance_ge_4",include,high,2026-05-18T18:14:57Z,227.8772,mature_72h,true,conservative
cand_00379,news:3001:f75ecec6c060bc7f,2026-05-18T18:24:46Z,2026-05-19 02:24:46 UTC+8,2026-05-18T18:24:46Z,2026-05-19 02:24:46 UTC+8,,,,Asia/Shanghai,source_rule:tg:,,2026-05-19 02:24:46 UTC+8,2026-05-18T18:24:46Z,2026-05-19 02:24:46 UTC+8,published_at,Asia/Shanghai_for_naive_time,ok,,【ZEC最大空头】BRENTOIL 空单 摊平 啦!,"🏛️ 链上华尔街速报 | 巨鲸传统资产持仓异动 💸
📅 时间: 2026/5/19 02:24:45
🐘 【ZEC最大空头】BRENTOIL 空单 摊平 啦!
💵 标的: BRENTOIL空单增持 5,249.22 枚, 约合604,995.61美元
 ✦ 持仓规模: 5,581,930.91美元
 ✦ 均价: 102.31美元 → 102.75美元
 ✦ 当前盈亏: -247,679.02美元 (-8.46%)
 ✦ 当前价格: 107.52美元
 ✦ 清算价: 159.90美元
📌 地址: 0xd47587702a91731Dc1089B5DB0932cF820151A91
🔥 注: 该地址在184美元起做空ZEC，曾浮亏2100万，后扭亏为盈，近期成为标普500最大多头，规模超7000万。 🔥
Hyperliquid 官网查看:https://app.hyperliquid.xyz/",tg:HyperInsight,https://t.me/HyperInsight/88736,BTC,BTCUSDT,BTCUSDT,macro,observe,4,market_wide,medium,high,true,include,,market_wide_event,105,"has_asset,has_binance_symbol,time_ok,typed_event,time_confidence_high,importance_ge_4",include,high,2026-05-18T18:24:46Z,227.7136,mature_72h,true,conservative
cand_00376,news:1033:a7d2aa566701004a,2026-05-18T18:27:39Z,2026-05-19 02:27:39 UTC+8,2026-05-18T18:27:39Z,2026-05-19 02:27:39 UTC+8,,,,Asia/Shanghai,source_rule:news:jin10,,2026-05-19 02:27:39 UTC+8,2026-05-18T18:27:39Z,2026-05-19 02:27:39 UTC+8,published_at,Asia/Shanghai_for_naive_time,ok,,美媒：特朗普盟友敦促其在AI模型发布前进行测试和审查,据Axios报道，一封信函显示，特朗普的60多名忠实盟友正敦促他在最强大的AI模型发布前对其进行测试并予以批准。这封信由史蒂夫·班农以及保守派反AI活动人士等联名签署，使得“MAGA”支持者中的一股活跃势力与白宫对人工智能采取的放任态度产生了分歧。在白宫内部，主流观点认为，美国将通过保持宽松的监管并推翻大多数州级人工智能法律，从而赢得人工智能竞赛。班农表示：“这封信让我们更进一步，信中明确指出，我们必须（对AI模型）实施强制检测并获得政府批准。”信中观点将AI与核系统及航空业等相类比：“那些目前或不久后就能协助设计生物武器、侵入关键基础设施或操纵金融市场的人工智能系统，应当受到同等的重视和谨慎对待。”信中支持那些要求在部署此类潜在危险的前沿人工智能系统之前，必须对其进行强制性测试、评估、审查以及政府批准的政策。,news:jin10,https://www.jin10.com/detail/20260518182739773800.html,BTC,BTCUSDT,BTCUSDT,macro,observe,4,market_wide,medium,high,true,include,,market_wide_event,105,"has_asset,has_binance_symbol,time_ok,typed_event,time_confidence_high,importance_ge_4",include,high,2026-05-18T18:27:39Z,227.6656,mature_72h,true,conservative
cand_00370,news:1033:6fcf78c39f190b28,2026-05-18T18:35:14Z,2026-05-19 02:35:14 UTC+8,2026-05-18T18:35:14Z,2026-05-19 02:35:14 UTC+8,,,,Asia/Shanghai,source_rule:news:jin10,,2026-05-19 02:35:14 UTC+8,2026-05-18T18:35:14Z,2026-05-19 02:35:14 UTC+8,published_at,Asia/Shanghai_for_naive_time,ok,,据日经新闻：巴西外长表示，巴西准备增加对日本的原油出口,据日经新闻：巴西外长表示，巴西准备增加对日本的原油出口。,news:jin10,https://www.jin10.com/detail/20260518183514777800.html,BTC,BTCUSDT,BTCUSDT,macro,observe,4,market_wide,medium,high,true,include,,market_wide_event,105,"has_asset,has_binance_symbol,time_ok,typed_event,time_confidence_high,importance_ge_4",include,high,2026-05-18T18:35:14Z,227.5392,mature_72h,true,conservative
cand_00367,news:1033:6ee9e427d5f58cb0,2026-05-18T18:44:32Z,2026-05-19 02:44:32 UTC+8,2026-05-18T18:44:32Z,2026-05-19 02:44:32 UTC+8,,,,Asia/Shanghai,source_rule:news:jin10,,2026-05-19 02:44:32 UTC+8,2026-05-18T18:44:32Z,2026-05-19 02:44:32 UTC+8,published_at,Asia/Shanghai_for_naive_time,ok,,世界银行：提供3.5亿美元融资以帮助应对孟加拉国燃料市场波动,世界银行：提供3.5亿美元融资以帮助应对孟加拉国燃料市场波动。,news:jin10,https://www.jin10.com/detail/20260518184432561800.html,BTC,BTCUSDT,BTCUSDT,macro,observe,4,market_wide,medium,high,true,include,,market_wide_event,105,"has_asset,has_binance_symbol,time_ok,typed_event,time_confidence_high,importance_ge_4",include,high,2026-05-18T18:44:32Z,227.3842,mature_72h,true,conservative
cand_00357,news:1023:47c2fa71d3005585,2026-05-18T19:00:00Z,2026-05-19 03:00:00 UTC+8,2026-05-18T19:00:00Z,2026-05-19 03:00:00 UTC+8,,,,UTC,source_rule:news:cryptonews,,2026-05-19 03:00:00 UTC+8,2026-05-18T19:00:00Z,2026-05-19 03:00:00 UTC+8,published_at,Asia/Shanghai_for_naive_time,ok,,"ZachXBT offers $10,000 bounty for evidence against Hong Kong market maker HSBG","ZachXBT is offering up to $10,000 for insider evidence that Hong Kong market maker HSBG manipulated centralized exchange markets, including trades around RIVER.

On-chain sleuth ZachXBT has announced a bounty of up to $10,000 for whistleblowers who can provide credible insider evidence of market manipulation tied to Hong Kong market maker “Heisenberg Guru” (HSBG). In a post shared via his investigations channel, he claimed that HSBG has been involved in “multiple market manipulation incidents” on centralized exchanges, singling out trading around the token RIVER as one of the affected markets.

JUST IN: @zachxbt is offering up to $10K for intel on Hong Kong market maker Heisenberg Guru, also known as HSBG, over alleged links to multiple CEX market manipulation incidents, including $RIVER . pic.twitter.com/Y1xrTJoAuP

According to his statement, the goal of the bounty is to surface hard evidence that could substantiate or refute suspicions circulating in trading circles about HSBG’s tactics on order books. By explicitly framing the offer around “insider information,” ZachXBT is clearly aiming to reach people who have worked with, or inside, the market-making operation and have direct visibility into its strategies and instructions.

He also emphasized that the maximum payout is “up to” $10,000, implying that rewards will scale with the quality, relevance, and verifiability of the submissions rather than being a flat fee. That structure mirrors how he has handled other crowdsourced investigations, where documentation that can be independently confirmed often receives higher compensation than anonymous accusations.

In his call for information, ZachXBT named “Sion” and “Chao” as core members of the HSBG operation, effectively putting specific individuals, rather than just a trading handle, under the spotlight. He suggested that a broad range of materials could be eligible for rewards, including chat records, contracts, and other internal communications that shed light on how HSBG coordinates trading activity on centralized exchanges.

Potential whistleblowers are being asked to submit tips by sending him a private message on X, where he runs most of his public-facing investigative work. While he did not outline an explicit verification process in the initial announcement, his prior investigations have typically involved cross-checking on-chain data, platform logs, and corroborating testimony before publishing detailed reports.

The move underlines the growing role of independent on-chain investigators in policing grey-zone behavior in crypto markets, particularly in areas like thinly traded CEX listings where formal enforcement remains patchy. If the bounty surfaces credible documentation of manipulation linked to HSBG or any associated accounts, it could increase pressure on exchanges to revisit their relationships with certain market makers and potentially spur regulators to take a closer look at trading practices in the Hong Kong-linked segment of the market.",news:cryptonews,https://crypto.news/zachxbt-offers-10000-bounty-for-evidence-against-hong-kong-market-maker-hsbg/,BTC,BTCUSDT,BTCUSDT,macro,observe,4,market_wide,medium,high,true,include,,market_wide_event,105,"has_asset,has_binance_symbol,time_ok,typed_event,time_confidence_high,importance_ge_4",include,high,2026-05-18T19:00:00Z,227.1264,mature_72h,true,conservative
cand_00351,news:3001:ed1ef426ef9a061a,2026-05-18T19:04:45Z,2026-05-19 03:04:45 UTC+8,2026-05-18T19:04:45Z,2026-05-19 03:04:45 UTC+8,,,,Asia/Shanghai,source_rule:tg:,,2026-05-19 03:04:45 UTC+8,2026-05-18T19:04:45Z,2026-05-19 03:04:45 UTC+8,published_at,Asia/Shanghai_for_naive_time,ok,,【ZEC最大空头】BRENTOIL 空单 摊平 啦!,"🏛️ 链上华尔街速报 | 巨鲸传统资产持仓异动 💸
📅 时间: 2026/5/19 03:04:45
🐘 【ZEC最大空头】BRENTOIL 空单 摊平 啦!
💵 标的: BRENTOIL空单增持 5,908.13 枚, 约合538,677.04美元
 ✦ 持仓规模: 6,120,607.95美元
 ✦ 均价: 102.75美元 → 103.20美元
 ✦ 当前盈亏: -153,072.71美元 (-5.01%)
 ✦ 当前价格: 105.85美元
 ✦ 清算价: 154.78美元
📌 地址: 0xd47587702a91731Dc1089B5DB0932cF820151A91
🔥 注: 该地址在184美元起做空ZEC，曾浮亏2100万，后扭亏为盈，近期成为标普500最大多头，规模超7000万。 🔥
Hyperliquid 官网查看:https://app.hyperliquid.xyz/",tg:HyperInsight,https://t.me/HyperInsight/88737,BTC,BTCUSDT,BTCUSDT,macro,observe,4,market_wide,medium,high,true,include,,market_wide_event,105,"has_asset,has_binance_symbol,time_ok,typed_event,time_confidence_high,importance_ge_4",include,high,2026-05-18T19:04:45Z,227.0472,mature_72h,true,conservative
