manual_decision,manual_event_type_l1,manual_event_type_l2,manual_primary_asset_symbol,manual_channel_route,manual_useful_for_research,manual_notes,label_source,candidate_id,published_at,published_at_utc,published_at_china,backtest_time,backtest_time_utc,backtest_time_china,source_timezone,source_timezone_assumption,title,content,source,url,primary_asset_symbol,candidate_asset_symbol,event_type_l1,event_type_l2,event_scope,publish_decision,research_priority,channel_route,tradability_tier,tradability_tier_reason,relevance_score_realtime,discard_reason,relevance_flags,detected_entity_names,entity_flags,suggested_manual_decision,suggested_manual_event_type_l1,suggested_manual_event_type_l2,suggested_manual_primary_asset_symbol,suggested_manual_channel_route,suggested_manual_useful_for_research,auto_label_confidence,auto_label_reasons,auto_label_apply,auto_prefilled,manual_review_required,label_origin,review_queue
discard,regulation_macro,bitcoin_reserve_policy,BTC,macro_policy,no,auto_provisional(conf=1.00),discard_audit,cand_00207,2026-05-19 05:47:48 UTC+8,2026-05-18T21:47:48Z,2026-05-19 05:47:48 UTC+8,2026-05-19 05:47:48 UTC+8,2026-05-18T21:47:48Z,2026-05-19 05:47:48 UTC+8,UTC,source_rule:news:cointelegraph,3 Factors May Send Bitcoin Price Back To $80K,"3 Factors May Send Bitcoin Price Back To $80K Ecosystem English News Markets Features Learn Sponsored About XMR $384.53 2.53% LINK $9.58 1.27% DOGE $0.1053 4.54% ADA $0.2524 0.68% BTC $77,096 1.23% ZEC $566.77 3.95% SOL $85.59 0.79% XRP $1.39 1.44% BCH $375.81 9.65% ETH $2,136 2.18% HYPE $47.04 1.07% TRX $0.3561 0.06% BNB $645.47 1.43% Written by Marcel Pechman ⁠, Staff Writer. Reviewed by Ray Salmond ⁠, Staff Editor. Written by Marcel Pechman ⁠, Staff Writer. Reviewed by Ray Salmond ⁠, Staff Editor. Bitcoin lost its hold on $80K, but three events may send it back sooner than markets expect Markets Published May 18, 2026 Bitcoin positions itself for a rally above $80,000 after Strategy's $2 billion BTC buy, crumbling investor confidence in the US Treasury and a potential US-Iran deal. Key takeaways: Aggressive Bitcoin buying by Strategy helped to offset the recent leveraged long liquidations. Rising bond yields and a heavy US government debt burden are driving investors toward scarce assets. A potential deal between the US and Iran could quickly restore traders’ risk appetite. Bitcoin (BTC) faced a rejection following a failed attempt to break above $82,000 on Thursday. A subsequent retest of the $76,000 level on Monday triggered $400 million in liquidations for bullish Bitcoin positions over a four-day period. While traders’ confidence took a hit from the 7% price decline, the prospects for recovering the $80,000 mark remain valid. Bitcoin reserve accumulation by Strategy (MSTR US). Source: Strategy US-listed Strategy (MSTR US) completed the acquisition of $2 billion in BTC over the past week alone. Spearheaded by Michael Saylor, the company continues to surprise investors by finding innovative ways to reduce the cost of capital and raise cash through equity issuance, whether via MSTR common stock or STRC preferred equity. More importantly, Strategy proved the company can also capitalize on a weaker market by repurchasing $1.5 billion of its debt due in 2029. Retiring some of its senior convertible notes reduces potential future dilution for current MSTR holders. This move clears the runway for new share issuance and additional Bitcoin purchases. S&P 500 index (left) vs. US 10-year Treasury yield (right). Source: TradingView From a macroeconomic perspective, the odds of a sustainable bullish momentum for Bitcoin improved as traders demanded higher returns to hold government bonds. Yields on the 10-year Treasury jumped to 4.60%, hitting their highest level in 16 months. Investors are gradually realizing the heavy burden on the US Treasury, especially with $2 trillion in long-term debt maturing in 2026. US dollar weakness and a potential deal with Iran The US Federal Reserve will likely need to continue accumulating bonds and Treasurys, a move that potentially weakens the US dollar. Typically, investors seek shelter in scarce assets when they lose confidence in the central bank's ability to navigate a crisis without devaluing the currency. Even if gold acts as the primary beneficiary, the incentive to hold fixed-income assets drops significantly. Gold/USD (left) vs. Bitcoin/USD (right). Source: TradingView Gold prices surged in January after the US captured Venezuelan President Nicolas Maduro and President Trump’s global trade war escalated. However, gold retraced most of those gains over the next four months, while Bitcoin built strong bullish momentum, jumping to $76,500 from $65,000 in late February. These recent price moves hint at growing confidence in Bitcoin as a reliable hedge instrument. Related: Analysts debate whether Bitcoin is in ‘sell in May’ bear market setup Crude Brent oil prices jumped to $113 on Monday as negotiations to fully reopen the Strait of Hormuz backpedaled. Oil prices have surged more than 50% since the US and Israel attacked Iran in late February. President Trump’s administration also decided not to renew a waiver for Russian crude oil, further squeezing supply, according to Yahoo Finance. A deal between the US and Iran, while not the baseline scenario, could trigger renewed risk appetite and catapult the Bitcoin price back above $80,000 . Inflation has been pinned down by high energy prices, limiting the odds of expansionary monetary policies. Even so, the odds favor Bitcoin, as the US stock market is hovering near its all-time high while the cryptocurrency still sits 39% below its peak. This article is produced in accordance with Cointelegraph's Editorial Policy and is intended for informational purposes only. It does not constitute investment advice or recommendations. All investments and trades carry risk; readers are encouraged to conduct independent research. Markets Cryptocurrencies Bitcoin Price MicroStrategy Gold Bonds Market Analysis Bitcoin More on the subject Bitcoin’s trend defining battle starts at the $74K support: Analyst 3 hours ago Biraajmaan Tamuly Price predictions 5/18: SPX, DXY, BTC, ETH, XRP, BNB, SOL, DOGE, HYPE, ADA 5 hours ago Rakesh Upadhyay Bitcoin price hits $76K, lowest since April after $1B ETF net outflow 6 hours ago William Suberg Bitcoin’s trend defining battle starts at the $74K support: Analyst 3 hours ago Biraajmaan Tamuly Price predictions 5/18: SPX, DXY, BTC, ETH, XRP, BNB, SOL, DOGE, HYPE, ADA 5 hours ago Rakesh Upadhyay Bitcoin price hits $76K, lowest since April after $1B ETF net outflow 6 hours ago William Suberg News Latest News Markets Bitcoin Ethereum Altcoins Blockchain Regulation Sponsored Sponsored Articles Press Releases Research Ecosystem Magazine Accelerator Events Decentralization Guardians LONGITUDE Event About About Cointelegraph Editorial Policy Ads Disclosure Financial Risk Disclaimer Cointelegraph is committed to providing independent, high-quality journalism across the crypto, blockchain, AI, and fintech industries. All news, reviews, and analyses are produced with full journalistic independence and integrity. For more details on our standards and processes, please read our Editorial Policy . © Cointelegraph 2013 - 2026 Terms of Service and Privacy Policy",news:cointelegraph,https://cointelegraph.com/markets/bitcoin-lost-its-hold-on-80k-but-three-events-may-send-it-back-sooner-than-markets-expect?utm_source=rss_feed&utm_medium=rss&utm_campaign=rss_partner_inbound,BTC,,regulation_macro,bitcoin_reserve_policy,multi_asset,discard,discard,macro_policy,T2,market_wide_or_policy_event,68.0,duplicate_non_primary,,Bitcoin|Ethereum|Solana|BNB|XRP|Dogecoin|Cardano|Chainlink|Hyperliquid|Zcash|TRON|Bitcoin Cash|Monero|Strategy,"multiple_assets_detected,candidate_asset_mismatch",discard,regulation_macro,bitcoin_reserve_policy,BTC,macro_policy,no,1.0,"publish_decision=discard,channel_route=macro_policy,event_type_l1_specific,event_scope=multi_asset,asset_present",false,,true,auto_provisional,
discard,regulation_macro,macro,XRP,macro_policy,no,auto_provisional(conf=1.00),discard_audit,cand_00412,2026-05-19 01:52:03 UTC+8,2026-05-18T17:52:03Z,2026-05-19 01:52:03 UTC+8,2026-05-19 01:52:03 UTC+8,2026-05-18T17:52:03Z,2026-05-19 01:52:03 UTC+8,UTC,source_rule:news:cryptonews,Trump's visit to China triggered volatility in global financial markets. XRP/BTC could continue to rise after the US-China summit,"Disclosure: This article does not represent investment advice. The content and materials featured on this page are for educational purposes only.

XRP Power gains attention as global market shifts revive interest in AI-driven crypto platforms.

Trump’s recent visit to China has once again become the focus of global financial markets. As the two sides discussed issues such as trade, artificial intelligence, and global economic stability, market risk sentiment has begun to shift significantly. Affected by this, digital assets such as Bitcoin and XRP have seen renewed activity, and the overall trading volume of the cryptocurrency market has continued to recover.

Against the backdrop of global capital seeking new growth opportunities, more and more investors are beginning to pay attention to new trends in the digital asset field. Compared to traditional high-volatility short-term trading, some users are turning to more intelligent and structured participation methods. AI technology, automated systems, and transparent operating models are gradually becoming new focuses in the industry.

In this market environment, XRP Power is beginning to attract more users. As a platform focusing on AI intelligent systems and the digital asset ecosystem, XRP Power attracts more and more users interested in digital finance and intelligent technology through automated management, real-time risk control monitoring, and global APP services. As market sentiment gradually recovers, attention is turning to XRP Power, with an increasing number of investors flocking to it amidst the global financial upheaval and crypto market recovery.

XRP Power AI intelligent system’s five core advantages:

1. Employs an intelligent AI automation system, enabling real-time data analysis and automated operation, further improving overall efficiency.

2. Supports global APP services, simplifying the operation process and allowing new users to quickly get started.

3. Introduces a multi-layered AI risk control monitoring mechanism, combined with a real-time security system, ensuring more stable and transparent operation.

4. Reduces the barriers to entry for traditionally complex operations through intelligent computing power scheduling and automated management, enhancing user experience.

5. Integrates AI technology with the digital asset ecosystem, continuously optimizing platform competitiveness through a transparent system and global services.

XRP Power intelligent AI participation process:

1. Quickly register an XRP Power account using an email address; new users also receive $21 in trial funds.

2. Users can freely choose intelligent AI solutions with different periods based on their needs, each corresponding to a different return model.

3. XRP Power fully supports participation in mainstream cryptocurrencies, offering greater flexibility and convenience.

4. Daily earnings will be automatically synchronized to your account balance via an intelligent AI system. Users can choose to withdraw directly or configure other earnings plans.

Contract Name: DOGE [AI Intelligent Quantification] Investment Amount: $10,000, Period: 20 days, Daily Earnings: $153, Total Earnings: $3,060, Principal Refund at Maturity: $10,000

Contract Name: BTC/BCH [AI Global Smart Ecosystem] Investment Amount: $50,000, Period: 27 days, Daily Earnings: $860, Total Earnings: $23,220, Principal Refund at Maturity: $50,000

Faced with the continued volatility of the global financial market and the rapid development of AI technology, more and more users are beginning to rethink how they participate in digital assets. Compared to traditional high-frequency trading models, intelligent, automated, and more transparent and convenient digital financial ecosystems are becoming the new direction for industry development.

As market attention continues to rise, XRP Power is gradually gaining more user and market attention thanks to its AI intelligent system, global services, and more efficient digital asset experience.

For details, visit the official website .

Digital assets, stocks, gold, and other global financial markets are subject to volatility. Their prices may be affected by various factors such as the international economic environment, market sentiment, policy adjustments, and industry changes. Before participating in any digital asset or smart contract, users should fully understand the relevant rules and market characteristics and participate rationally according to their own risk tolerance.

Compared to traditional high-frequency trading models, XRP Power places greater emphasis on AI intelligent management, real-time risk control, and system stability. The platform continuously optimizes overall operational efficiency through intelligent data analysis, multi-layered risk control mechanisms, and real-time monitoring systems.

Meanwhile, users are advised to thoroughly understand the platform rules, contract periods, and related instructions before participating, rationally plan their capital allocation, enhance their risk awareness, and participate in the digital financial market in a long-term and rational manner.

Disclosure: This content is provided by a third party. Neither crypto.news nor the author of this article endorses any product mentioned on this page. Users should conduct their own research before taking any action related to the company.",news:cryptonews,https://crypto.news/trumps-visit-to-china-triggered-volatility-in-global-financial-markets-xrp-btc-could-continue-to-rise-after-the-us-china-summit/,XRP,,regulation_macro,macro,multi_asset,discard,discard,macro_policy,T2,market_wide_or_policy_event,66.75,"duplicate_non_primary,scraped_footer_noise",,Bitcoin|XRP|AI,"multiple_assets_detected,candidate_asset_mismatch,scraped_footer_noise",discard,regulation_macro,macro,XRP,macro_policy,no,1.0,"publish_decision=discard,channel_route=macro_policy,event_type_l1_specific,event_scope=multi_asset,asset_present",false,,true,auto_provisional,
discard,regulation_macro,macro,XRP,macro_policy,no,auto_provisional(conf=0.95),discard_audit,cand_00466,2026-05-19 01:04:05 UTC+8,2026-05-18T17:04:05Z,2026-05-19 01:04:05 UTC+8,2026-05-19 01:04:05 UTC+8,2026-05-18T17:04:05Z,2026-05-19 01:04:05 UTC+8,Asia/Shanghai,default_china,"'XRP Is the World Bridge Currency,' Says LIFTT Capital's Ted","Writer by choice, CryptoCurrency Writer, and Researcher by chance. Currently, focusing on financial news and analysis, as well as cryptocurrency news and data. One may not call me a crypto “Enthusiast” but trust me I'm getting there.

Writer by choice, CryptoCurrency Writer, and Researcher by chance. Currently, focusing on financial news and analysis, as well as cryptocurrency news and data. One may not call me a crypto “Enthusiast” but trust me I'm getting there.

Writer by choice, CryptoCurrency Writer, and Researcher by chance. Currently, focusing on financial news and analysis, as well as cryptocurrency news and data. One may not call me a crypto “Enthusiast” but trust me I'm getting there.

At Hederacon, an official side event to Consensus 2026 in Miami, Ted from LIFTT Capital was asked one question about XRP and his answer was three words. ‘World Bridge Currency,’ he said.

Ted’s explanation starts with a simple observation about where the financial world currently sits. PayPal, Cash App, and every major payment platform operate as closed loops. Money goes in, money stays inside. Moving value between these walled gardens is slow, expensive, and dependent on intermediaries that add friction at every step.

The solution he described is interoperability, the ability for these closed systems to connect and exchange value seamlessly. And in his view, the bridge currency that enables that connection is XRP.

“I am not talking about a coin. I am not talking about a dollar. I am not talking about an exchange note,” Ted said. “Currency is the purest form of money and that is what we are going to be seeing with XRP.”

One of the most common debates inside the XRP community is whether RLUSD, Ripple’s dollar-backed stablecoin, competes with or complements XRP. Ted was direct about where he stands.

For XRP to function as a global bridge currency at scale, it needs a stable layer that provides liquidity without price volatility during settlement. RLUSD provides that stability. XRP provides the bridge. The two are designed to work together rather than compete.

He pointed to Brad Garlinghouse and Monica Long having publicly stated that Ripple is actively arranging for XRP to serve as the world bridge currency, describing it not as hype but as observable direction.

“Brad Garlinghouse said it on stage at XRP Las Vegas. We are moving toward a multi-chain world,” Ted said. “That is not tribalism. That is where the technology is actually going.”",news:coinpedia,https://coinpedia.org/news/xrp-is-the-world-bridge-currency-says-liftt-capitals-ted/,XRP,,regulation_macro,macro,multi_asset,discard,discard,macro_policy,T2,market_wide_or_policy_event,66.25,"unsupported_asset,duplicate_non_primary",,XRP,candidate_asset_mismatch,discard,regulation_macro,macro,XRP,macro_policy,no,0.95,"publish_decision=discard,channel_route=macro_policy,event_type_l1_specific,event_scope=multi_asset,asset_present,asset_quality_risk",false,,true,auto_provisional,
discard,regulation_macro,regulation,XRP,macro_policy,no,auto_provisional(conf=1.00),discard_audit,cand_00468,2026-05-19 01:03:28 UTC+8,2026-05-18T17:03:28Z,2026-05-19 01:03:28 UTC+8,2026-05-19 01:03:28 UTC+8,2026-05-18T17:03:28Z,2026-05-19 01:03:28 UTC+8,Asia/Shanghai,default_china,XRP Co-Creator David Schwartz Donates XRP to John Deaton's Senate Campaign,"Writer by choice, CryptoCurrency Writer, and Researcher by chance. Currently, focusing on financial news and analysis, as well as cryptocurrency news and data. One may not call me a crypto “Enthusiast” but trust me I'm getting there.

Writer by choice, CryptoCurrency Writer, and Researcher by chance. Currently, focusing on financial news and analysis, as well as cryptocurrency news and data. One may not call me a crypto “Enthusiast” but trust me I'm getting there.

Writer by choice, CryptoCurrency Writer, and Researcher by chance. Currently, focusing on financial news and analysis, as well as cryptocurrency news and data. One may not call me a crypto “Enthusiast” but trust me I'm getting there.

Ripple’s Chief Technology Officer David Schwartz, known online as JoelKatz, has sent an undisclosed amount of XRP to support attorney John Deaton’s US Senate campaign. The move quickly gained attention across the XRP community, not just because of who made the donation but because of the history between the two men.

Schwartz is one of the three original architects of the XRP Ledger. Deaton is the lawyer who led 75,000 XRP holders in an independent legal fight against the SEC that helped produce one of the most significant rulings in crypto legal history.

Deaton did not take the gesture lightly. In a post on X he described Schwartz as a “legit genius” and laid out exactly why the contribution meant something beyond a standard campaign donation.

He reminded his followers that before building the XRP Ledger, Schwartz worked as a contractor for the NSA developing encrypted cloud storage and enterprise messaging systems. He then contributed to Bitcoin’s codebase in 2011 before joining forces with Jed McCaleb and the famously private Arthur Britto to co-create the XRP Ledger from scratch.

The ledger they built in 2011 and launched in 2012 settles payments in three seconds, handles 1,500 transactions per second, and contained the world’s very first decentralised exchange built directly into its protocol. Deaton called it a technology that helped lead the crypto revolution alongside Bitcoin and Ethereum.

“Three legends. One ledger. And it is an honor for one of them to help me try and bring commonsense-based, nonpartisan leadership to the US Senate,” Deaton wrote.

The significance of Schwartz supporting Deaton goes beyond mutual respect between crypto figures. The two are connected by one of the most consequential legal battles the cryptocurrency industry has ever seen.

Deaton and 75,000 XRP holders took on the SEC completely independently of Ripple’s own legal defence. He submitted amicus briefs, made oral arguments in the LBRY case that were later cited by the judge in the Ripple ruling, and submitted 4,000 XRP holder affidavits directly into the case record.

When Judge Analisa Torres ruled that XRP in and of itself is not a security, she cited Deaton’s work directly in her opinion. The ruling that now forms the legal backbone of the CLARITY Act’s treatment of XRP was shaped in part by a lawyer who is now running for Senate.",news:coinpedia,https://coinpedia.org/news/xrp-co-creator-david-schwartz-donates-xrp-to-john-deatons-senate-campaign/,XRP,,regulation_macro,regulation,multi_asset,discard,discard,macro_policy,T2,market_wide_or_policy_event,66.25,duplicate_non_primary,,XRP|SEC,candidate_asset_mismatch,discard,regulation_macro,regulation,XRP,macro_policy,no,1.0,"publish_decision=discard,channel_route=macro_policy,event_type_l1_specific,event_scope=multi_asset,asset_present",false,,true,auto_provisional,
